2026-01-26 06:23:25,444 | INFO | WIRESHARK | Ether / IP / TCP 172.21.174.213:40420 > 167.82.56.223:https A
2026-01-26 06:23:25,519 | INFO | WIRESHARK | Ether / IP / TCP 167.82.56.223:https > 172.21.174.213:40420 
2026-01-26 06:23:25,521 | INFO | WIRESHARK | Ether / IP / TCP 167.82.56.223:https > 172.21.174.213:40420 A / Raw
2026-01-26 06:23:25,524 | INFO | WIRESHARK | Ether / IP / TCP 167.82.56.223:https > 172.21.174.213:40420 
2026-01-26 06:23:25,528 | INFO | WIRESHARK | Ether / IP / TCP 167.82.56.223:https > 172.21.174.213:40420 A / Raw
2026-01-26 06:23:25,531 | INFO | WIRESHARK | Ether / IP / TCP 172.21.174.213:40420 > 167.82.56.223:https 
2026-01-26 06:23:25,535 | INFO | WIRESHARK | Ether / IP / TCP 172.21.174.213:40420 > 167.82.56.223:https A
2026-01-26 06:23:25,538 | INFO | WIRESHARK | Ether / IP / TCP 172.21.174.213:40420 > 167.82.56.223:https 
2026-01-26 06:23:25,544 | INFO | WIRESHARK | Ether / IP / TCP 172.21.174.213:40420 > 167.82.56.223:https A
2026-01-26 06:23:25,600 | INFO | WIRESHARK | Ether / IP / TCP 167.82.56.223:https > 172.21.174.213:40420 
2026-01-26 06:23:25,601 | INFO | WIRESHARK | Ether / IP / TCP 167.82.56.223:https > 172.21.174.213:40420 A / Raw
2026-01-26 06:23:25,606 | INFO | WIRESHARK | Ether / IP / TCP 172.21.174.213:40420 > 167.82.56.223:https 
2026-01-26 06:23:25,608 | INFO | WIRESHARK | Ether / IP / TCP 172.21.174.213:40420 > 167.82.56.223:https A
2026-01-26 06:23:25,611 | INFO | WIRESHARK | Ether / IP / TCP 167.82.56.223:https > 172.21.174.213:40420 
2026-01-26 06:23:25,614 | INFO | WIRESHARK | Ether / IP / TCP 167.82.56.223:https > 172.21.174.213:40420 A / Raw
2026-01-26 06:23:25,652 | INFO | WIRESHARK | Ether / IP / TCP 172.21.174.213:40420 > 167.82.56.223:https 
2026-01-26 06:23:25,653 | INFO | WIRESHARK | Ether / IP / TCP 172.21.174.213:40420 > 167.82.56.223:https A
2026-01-26 06:23:25,683 | INFO | WIRESHARK | Ether / IP / TCP 167.82.56.223:https > 172.21.174.213:40420 
2026-01-26 06:23:25,684 | INFO | WIRESHARK | Ether / IP / TCP 167.82.56.223:https > 172.21.174.213:40420 A / Raw
2026-01-26 06:23:25,694 | INFO | WIRESHARK | Ether / IP / TCP 167.82.56.223:https > 172.21.174.213:40420 
2026-01-26 06:23:25,695 | INFO | WIRESHARK | Ether / IP / TCP 167.82.56.223:https > 172.21.174.213:40420 A / Raw
2026-01-26 06:23:25,702 | INFO | WIRESHARK | Ether / IP / TCP 172.21.174.213:40420 > 167.82.56.223:https A
2026-01-26 06:23:25,698 | INFO | WIRESHARK | Ether / IP / TCP 172.21.174.213:40420 > 167.82.56.223:https 
2026-01-26 06:23:25,728 | INFO | WIRESHARK | Ether / IP / TCP 167.82.56.223:https > 172.21.174.213:40420 A / Raw
2026-01-26 06:23:25,730 | INFO | WIRESHARK | Ether / IP / TCP 167.82.56.223:https > 172.21.174.213:40420 
2026-01-26 06:23:25,770 | INFO | WIRESHARK | Ether / IP / TCP 167.82.56.223:https > 172.21.174.213:40420 A / Raw
2026-01-26 06:23:25,775 | INFO | WIRESHARK | Ether / IP / TCP 172.21.174.213:40420 > 167.82.56.223:https A
2026-01-26 06:23:25,772 | INFO | WIRESHARK | Ether / IP / TCP 167.82.56.223:https > 172.21.174.213:40420 
2026-01-26 06:23:25,783 | INFO | WIRESHARK | Ether / IP / TCP 172.21.174.213:40420 > 167.82.56.223:https 
2026-01-26 06:23:25,786 | INFO | WIRESHARK | Ether / IP / TCP 167.82.56.223:https > 172.21.174.213:40420 
2026-01-26 06:23:25,790 | INFO | WIRESHARK | Ether / IP / TCP 172.21.174.213:40420 > 167.82.56.223:https 
2026-01-26 06:23:25,787 | INFO | WIRESHARK | Ether / IP / TCP 167.82.56.223:https > 172.21.174.213:40420 A / Raw
2026-01-26 06:23:25,796 | INFO | WIRESHARK | Ether / IP / TCP 172.21.174.213:40420 > 167.82.56.223:https A
2026-01-26 06:23:25,845 | INFO | WIRESHARK | Ether / IP / TCP 167.82.56.223:https > 172.21.174.213:40420 A / Raw
2026-01-26 06:23:25,846 | INFO | WIRESHARK | Ether / IP / TCP 167.82.56.223:https > 172.21.174.213:40420 
2026-01-26 06:23:25,849 | INFO | WIRESHARK | Ether / IP / TCP 172.21.174.213:40420 > 167.82.56.223:https A
2026-01-26 06:23:25,852 | INFO | WIRESHARK | Ether / IP / TCP 172.21.174.213:40420 > 167.82.56.223:https 
2026-01-26 06:23:25,862 | INFO | WIRESHARK | Ether / IP / TCP 167.82.56.223:https > 172.21.174.213:40420 
2026-01-26 06:23:25,863 | INFO | WIRESHARK | Ether / IP / TCP 167.82.56.223:https > 172.21.174.213:40420 A / Raw
2026-01-26 06:23:25,865 | INFO | WIRESHARK | Ether / IP / TCP 172.21.174.213:40420 > 167.82.56.223:https 
2026-01-26 06:23:25,868 | INFO | WIRESHARK | Ether / IP / TCP 172.21.174.213:40420 > 167.82.56.223:https A
2026-01-26 06:23:25,920 | INFO | WIRESHARK | Ether / IP / TCP 167.82.56.223:https > 172.21.174.213:40420 
2026-01-26 06:23:25,921 | INFO | WIRESHARK | Ether / IP / TCP 167.82.56.223:https > 172.21.174.213:40420 A / Raw
2026-01-26 06:23:25,937 | INFO | WIRESHARK | Ether / IP / TCP 167.82.56.223:https > 172.21.174.213:40420 
2026-01-26 06:23:25,940 | INFO | WIRESHARK | Ether / IP / TCP 167.82.56.223:https > 172.21.174.213:40420 PA / Raw
2026-01-26 06:23:25,948 | INFO | WIRESHARK | Ether / IP / TCP 172.21.174.213:40420 > 167.82.56.223:https A
2026-01-26 06:23:25,942 | INFO | WIRESHARK | Ether / IP / TCP 172.21.174.213:40420 > 167.82.56.223:https 
2026-01-26 06:23:25,959 | INFO | WIRESHARK | Ether / IP / TCP 172.21.174.213:41220 > 151.101.0.223:https 
2026-01-26 06:23:25,961 | INFO | WIRESHARK | Ether / IP / TCP 172.21.174.213:41220 > 151.101.0.223:https PA / Raw
2026-01-26 06:23:26,026 | INFO | WIRESHARK | Ether / IP / TCP 151.101.0.223:https > 172.21.174.213:41220 
2026-01-26 06:23:26,027 | INFO | WIRESHARK | Ether / IP / TCP 151.101.0.223:https > 172.21.174.213:41220 PA / Raw
2026-01-26 06:23:26,030 | INFO | WIRESHARK | Ether / IP / TCP 172.21.174.213:41220 > 151.101.0.223:https 
2026-01-26 06:23:26,034 | INFO | WIRESHARK | Ether / IP / TCP 172.21.174.213:41220 > 151.101.0.223:https A
2026-01-26 06:23:26,038 | INFO | WIRESHARK | Ether / IP / TCP 151.101.0.223:https > 172.21.174.213:41220 
2026-01-26 06:23:26,041 | INFO | WIRESHARK | Ether / IP / TCP 151.101.0.223:https > 172.21.174.213:41220 PA / Raw
2026-01-26 06:23:26,044 | INFO | WIRESHARK | Ether / IP / TCP 172.21.174.213:41220 > 151.101.0.223:https 
2026-01-26 06:23:26,047 | INFO | WIRESHARK | Ether / IP / TCP 172.21.174.213:41220 > 151.101.0.223:https A
2026-01-26 06:23:26,055 | INFO | WIRESHARK | Ether / IP / TCP 151.101.0.223:https > 172.21.174.213:41220 
2026-01-26 06:23:26,056 | INFO | WIRESHARK | Ether / IP / TCP 151.101.0.223:https > 172.21.174.213:41220 A / Raw
2026-01-26 06:23:26,059 | INFO | WIRESHARK | Ether / IP / TCP 172.21.174.213:41220 > 151.101.0.223:https 
2026-01-26 06:23:26,059 | INFO | METRIC | CPU: 2.1% | PKTS: 3942
2026-01-26 06:23:26,062 | INFO | WIRESHARK | Ether / IP / TCP 172.21.174.213:41220 > 151.101.0.223:https A
2026-01-26 06:23:26,090 | INFO | WIRESHARK | Ether / IP / TCP 151.101.0.223:https > 172.21.174.213:41220 
2026-01-26 06:23:26,091 | INFO | WIRESHARK | Ether / IP / TCP 151.101.0.223:https > 172.21.174.213:41220 PA / Raw
2026-01-26 06:23:26,094 | INFO | WIRESHARK | Ether / IP / TCP 172.21.174.213:41220 > 151.101.0.223:https 
2026-01-26 06:23:26,098 | INFO | WIRESHARK | Ether / IP / TCP 172.21.174.213:41220 > 151.101.0.223:https A
2026-01-26 06:23:26,101 | INFO | WIRESHARK | Ether / IP / TCP 151.101.0.223:https > 172.21.174.213:41220 
2026-01-26 06:23:26,103 | INFO | WIRESHARK | Ether / IP / TCP 151.101.0.223:https > 172.21.174.213:41220 PA / Raw
2026-01-26 06:23:26,106 | INFO | WIRESHARK | Ether / IP / TCP 172.21.174.213:41220 > 151.101.0.223:https 
2026-01-26 06:23:26,109 | INFO | WIRESHARK | Ether / IP / TCP 172.21.174.213:41220 > 151.101.0.223:https A
2026-01-26 06:23:26,122 | INFO | WIRESHARK | Ether / IP / TCP 151.101.0.223:https > 172.21.174.213:41220 A / Raw
2026-01-26 06:23:26,123 | INFO | WIRESHARK | Ether / IP / TCP 151.101.0.223:https > 172.21.174.213:41220 
2026-01-26 06:23:26,127 | INFO | WIRESHARK | Ether / IP / TCP 172.21.174.213:41220 > 151.101.0.223:https A
2026-01-26 06:23:26,131 | INFO | WIRESHARK | Ether / IP / TCP 172.21.174.213:41220 > 151.101.0.223:https 
2026-01-26 06:23:26,154 | INFO | WIRESHARK | Ether / IP / TCP 151.101.0.223:https > 172.21.174.213:41220 
2026-01-26 06:23:26,156 | INFO | WIRESHARK | Ether / IP / TCP 151.101.0.223:https > 172.21.174.213:41220 A / Raw
2026-01-26 06:23:26,159 | INFO | WIRESHARK | Ether / IP / TCP 172.21.174.213:41220 > 151.101.0.223:https 
2026-01-26 06:23:26,163 | INFO | WIRESHARK | Ether / IP / TCP 172.21.174.213:41220 > 151.101.0.223:https A
2026-01-26 06:23:26,166 | INFO | WIRESHARK | Ether / IP / TCP 151.101.0.223:https > 172.21.174.213:41220 
2026-01-26 06:23:26,170 | INFO | WIRESHARK | Ether / IP / TCP 151.101.0.223:https > 172.21.174.213:41220 PA / Raw
2026-01-26 06:23:26,173 | INFO | WIRESHARK | Ether / IP / TCP 172.21.174.213:41220 > 151.101.0.223:https 
2026-01-26 06:23:26,176 | INFO | WIRESHARK | Ether / IP / TCP 172.21.174.213:41220 > 151.101.0.223:https A
2026-01-26 06:23:26,179 | INFO | WIRESHARK | Ether / IP / TCP 151.101.0.223:https > 172.21.174.213:41220 
2026-01-26 06:23:26,182 | INFO | WIRESHARK | Ether / IP / TCP 151.101.0.223:https > 172.21.174.213:41220 A / Raw
2026-01-26 06:23:26,185 | INFO | WIRESHARK | Ether / IP / TCP 172.21.174.213:41220 > 151.101.0.223:https 
2026-01-26 06:23:26,187 | INFO | WIRESHARK | Ether / IP / TCP 172.21.174.213:41220 > 151.101.0.223:https A
2026-01-26 06:23:26,190 | INFO | WIRESHARK | Ether / IP / TCP 151.101.0.223:https > 172.21.174.213:41220 
2026-01-26 06:23:26,193 | INFO | WIRESHARK | Ether / IP / TCP 151.101.0.223:https > 172.21.174.213:41220 PA / Raw
2026-01-26 06:23:26,195 | INFO | WIRESHARK | Ether / IP / TCP 172.21.174.213:41220 > 151.101.0.223:https 
2026-01-26 06:23:26,197 | INFO | WIRESHARK | Ether / IP / TCP 172.21.174.213:41220 > 151.101.0.223:https A
2026-01-26 06:23:26,199 | INFO | WIRESHARK | Ether / IP / TCP 151.101.0.223:https > 172.21.174.213:41220 
2026-01-26 06:23:26,202 | INFO | WIRESHARK | Ether / IP / TCP 151.101.0.223:https > 172.21.174.213:41220 A / Raw
2026-01-26 06:23:26,204 | INFO | WIRESHARK | Ether / IP / TCP 172.21.174.213:41220 > 151.101.0.223:https 
2026-01-26 06:23:26,206 | INFO | WIRESHARK | Ether / IP / TCP 172.21.174.213:41220 > 151.101.0.223:https A
2026-01-26 06:23:26,209 | INFO | WIRESHARK | Ether / IP / TCP 151.101.0.223:https > 172.21.174.213:41220 
2026-01-26 06:23:26,211 | INFO | WIRESHARK | Ether / IP / TCP 151.101.0.223:https > 172.21.174.213:41220 PA / Raw
2026-01-26 06:23:26,214 | INFO | WIRESHARK | Ether / IP / TCP 172.21.174.213:41220 > 151.101.0.223:https 
2026-01-26 06:23:26,216 | INFO | WIRESHARK | Ether / IP / TCP 172.21.174.213:41220 > 151.101.0.223:https A
2026-01-26 06:23:26,258 | INFO | WIRESHARK | Ether / IP / TCP 151.101.0.223:https > 172.21.174.213:41220 
2026-01-26 06:23:26,259 | INFO | WIRESHARK | Ether / IP / TCP 151.101.0.223:https > 172.21.174.213:41220 A / Raw
2026-01-26 06:23:26,262 | INFO | WIRESHARK | Ether / IP / TCP 172.21.174.213:41220 > 151.101.0.223:https 
2026-01-26 06:23:26,266 | INFO | WIRESHARK | Ether / IP / TCP 172.21.174.213:41220 > 151.101.0.223:https A
2026-01-26 06:23:26,268 | INFO | WIRESHARK | Ether / IP / TCP 151.101.0.223:https > 172.21.174.213:41220 
2026-01-26 06:23:26,271 | INFO | WIRESHARK | Ether / IP / TCP 151.101.0.223:https > 172.21.174.213:41220 PA / Raw
2026-01-26 06:23:26,274 | INFO | WIRESHARK | Ether / IP / TCP 172.21.174.213:41220 > 151.101.0.223:https 
2026-01-26 06:23:26,277 | INFO | WIRESHARK | Ether / IP / TCP 172.21.174.213:41220 > 151.101.0.223:https A
2026-01-26 06:23:26,281 | INFO | WIRESHARK | Ether / IP / TCP 151.101.0.223:https > 172.21.174.213:41220 
2026-01-26 06:23:26,284 | INFO | WIRESHARK | Ether / IP / TCP 151.101.0.223:https > 172.21.174.213:41220 PA / Raw
2026-01-26 06:23:26,287 | INFO | WIRESHARK | Ether / IP / TCP 172.21.174.213:41220 > 151.101.0.223:https 
2026-01-26 06:23:26,290 | INFO | WIRESHARK | Ether / IP / TCP 172.21.174.213:41220 > 151.101.0.223:https A
2026-01-26 06:23:26,341 | INFO | WIRESHARK | Ether / IP / TCP 151.101.0.223:https > 172.21.174.213:41220 
2026-01-26 06:23:26,342 | INFO | WIRESHARK | Ether / IP / TCP 151.101.0.223:https > 172.21.174.213:41220 A / Raw
2026-01-26 06:23:26,345 | INFO | WIRESHARK | Ether / IP / TCP 172.21.174.213:41220 > 151.101.0.223:https 
2026-01-26 06:23:26,348 | INFO | WIRESHARK | Ether / IP / TCP 172.21.174.213:41220 > 151.101.0.223:https A
2026-01-26 06:23:26,351 | INFO | WIRESHARK | Ether / IP / TCP 151.101.0.223:https > 172.21.174.213:41220 
2026-01-26 06:23:26,353 | INFO | WIRESHARK | Ether / IP / TCP 151.101.0.223:https > 172.21.174.213:41220 A / Raw
2026-01-26 06:23:26,392 | INFO | WIRESHARK | Ether / IP / TCP 172.21.174.213:41220 > 151.101.0.223:https 
2026-01-26 06:23:26,394 | INFO | WIRESHARK | Ether / IP / TCP 172.21.174.213:41220 > 151.101.0.223:https A
2026-01-26 06:23:26,405 | INFO | WIRESHARK | Ether / IP / TCP 151.101.0.223:https > 172.21.174.213:41220 
2026-01-26 06:23:26,407 | INFO | WIRESHARK | Ether / IP / TCP 151.101.0.223:https > 172.21.174.213:41220 PA / Raw
2026-01-26 06:23:26,410 | INFO | WIRESHARK | Ether / IP / TCP 172.21.174.213:41220 > 151.101.0.223:https 
2026-01-26 06:23:26,414 | INFO | WIRESHARK | Ether / IP / TCP 172.21.174.213:41220 > 151.101.0.223:https A
2026-01-26 06:23:26,458 | INFO | WIRESHARK | Ether / IP / TCP 151.101.0.223:https > 172.21.174.213:41220 
2026-01-26 06:23:26,459 | INFO | WIRESHARK | Ether / IP / TCP 151.101.0.223:https > 172.21.174.213:41220 PA / Raw
2026-01-26 06:23:26,462 | INFO | WIRESHARK | Ether / IP / TCP 172.21.174.213:41220 > 151.101.0.223:https 
2026-01-26 06:23:26,465 | INFO | WIRESHARK | Ether / IP / TCP 172.21.174.213:41220 > 151.101.0.223:https A
2026-01-26 06:23:26,474 | INFO | WIRESHARK | Ether / IP / TCP 151.101.0.223:https > 172.21.174.213:41220 PA / Raw
2026-01-26 06:23:26,475 | INFO | WIRESHARK | Ether / IP / TCP 151.101.0.223:https > 172.21.174.213:41220 
2026-01-26 06:23:26,478 | INFO | WIRESHARK | Ether / IP / TCP 172.21.174.213:41220 > 151.101.0.223:https A
2026-01-26 06:23:26,481 | INFO | WIRESHARK | Ether / IP / TCP 172.21.174.213:41220 > 151.101.0.223:https 
2026-01-26 06:23:26,493 | INFO | WIRESHARK | Ether / IP / TCP 151.101.0.223:https > 172.21.174.213:41220 A / Raw
2026-01-26 06:23:26,494 | INFO | WIRESHARK | Ether / IP / TCP 151.101.0.223:https > 172.21.174.213:41220 
2026-01-26 06:23:26,528 | INFO | WIRESHARK | Ether / IP / TCP 151.101.0.223:https > 172.21.174.213:41220 
2026-01-26 06:23:26,529 | INFO | WIRESHARK | Ether / IP / TCP 151.101.0.223:https > 172.21.174.213:41220 PA / Raw
2026-01-26 06:23:26,533 | INFO | WIRESHARK | Ether / IP / TCP 172.21.174.213:41220 > 151.101.0.223:https 
2026-01-26 06:23:26,537 | INFO | WIRESHARK | Ether / IP / TCP 172.21.174.213:41220 > 151.101.0.223:https A
2026-01-26 06:23:26,541 | INFO | WIRESHARK | Ether / IP / TCP 151.101.0.223:https > 172.21.174.213:41220 
2026-01-26 06:23:26,545 | INFO | WIRESHARK | Ether / IP / TCP 151.101.0.223:https > 172.21.174.213:41220 PA / Raw
2026-01-26 06:23:26,548 | INFO | WIRESHARK | Ether / IP / TCP 172.21.174.213:41220 > 151.101.0.223:https 
2026-01-26 06:23:26,551 | INFO | WIRESHARK | Ether / IP / TCP 172.21.174.213:41220 > 151.101.0.223:https A
2026-01-26 06:23:26,593 | INFO | WIRESHARK | Ether / IP / TCP 151.101.0.223:https > 172.21.174.213:41220 
2026-01-26 06:23:26,594 | INFO | WIRESHARK | Ether / IP / TCP 151.101.0.223:https > 172.21.174.213:41220 PA / Raw
2026-01-26 06:23:26,598 | INFO | WIRESHARK | Ether / IP / TCP 172.21.174.213:41220 > 151.101.0.223:https 
2026-01-26 06:23:26,601 | INFO | WIRESHARK | Ether / IP / TCP 172.21.174.213:41220 > 151.101.0.223:https A
2026-01-26 06:23:26,625 | INFO | WIRESHARK | Ether / IP / TCP 151.101.0.223:https > 172.21.174.213:41220 
2026-01-26 06:23:26,627 | INFO | WIRESHARK | Ether / IP / TCP 151.101.0.223:https > 172.21.174.213:41220 A / Raw
2026-01-26 06:23:26,630 | INFO | WIRESHARK | Ether / IP / TCP 172.21.174.213:41220 > 151.101.0.223:https 
2026-01-26 06:23:26,633 | INFO | WIRESHARK | Ether / IP / TCP 172.21.174.213:41220 > 151.101.0.223:https A
2026-01-26 06:23:26,636 | INFO | WIRESHARK | Ether / IP / TCP 151.101.0.223:https > 172.21.174.213:41220 
2026-01-26 06:23:26,638 | INFO | WIRESHARK | Ether / IP / TCP 151.101.0.223:https > 172.21.174.213:41220 PA / Raw
2026-01-26 06:23:26,641 | INFO | WIRESHARK | Ether / IP / TCP 172.21.174.213:41220 > 151.101.0.223:https 
2026-01-26 06:23:26,644 | INFO | WIRESHARK | Ether / IP / TCP 172.21.174.213:41220 > 151.101.0.223:https A
2026-01-26 06:23:26,657 | INFO | WIRESHARK | Ether / IP / TCP 151.101.0.223:https > 172.21.174.213:41220 
2026-01-26 06:23:26,659 | INFO | WIRESHARK | Ether / IP / TCP 151.101.0.223:https > 172.21.174.213:41220 PA / Raw
2026-01-26 06:23:26,661 | INFO | WIRESHARK | Ether / IP / TCP 172.21.174.213:41220 > 151.101.0.223:https 
2026-01-26 06:23:26,664 | INFO | WIRESHARK | Ether / IP / TCP 172.21.174.213:41220 > 151.101.0.223:https A
2026-01-26 06:23:26,691 | INFO | WIRESHARK | Ether / IP / TCP 151.101.0.223:https > 172.21.174.213:41220 
2026-01-26 06:23:26,692 | INFO | WIRESHARK | Ether / IP / TCP 151.101.0.223:https > 172.21.174.213:41220 A / Raw
2026-01-26 06:23:26,696 | INFO | WIRESHARK | Ether / IP / TCP 172.21.174.213:41220 > 151.101.0.223:https 
2026-01-26 06:23:26,699 | INFO | WIRESHARK | Ether / IP / TCP 172.21.174.213:41220 > 151.101.0.223:https A
2026-01-26 06:23:26,702 | INFO | WIRESHARK | Ether / IP / TCP 151.101.0.223:https > 172.21.174.213:41220 
2026-01-26 06:23:26,706 | INFO | WIRESHARK | Ether / IP / TCP 151.101.0.223:https > 172.21.174.213:41220 A / Raw
2026-01-26 06:23:26,708 | INFO | WIRESHARK | Ether / IP / TCP 172.21.174.213:41220 > 151.101.0.223:https 
2026-01-26 06:23:26,711 | INFO | WIRESHARK | Ether / IP / TCP 172.21.174.213:41220 > 151.101.0.223:https A
2026-01-26 06:23:26,723 | INFO | WIRESHARK | Ether / IP / TCP 151.101.0.223:https > 172.21.174.213:41220 
2026-01-26 06:23:26,724 | INFO | WIRESHARK | Ether / IP / TCP 151.101.0.223:https > 172.21.174.213:41220 PA / Raw
2026-01-26 06:23:26,728 | INFO | WIRESHARK | Ether / IP / TCP 172.21.174.213:41220 > 151.101.0.223:https 
2026-01-26 06:23:26,731 | INFO | WIRESHARK | Ether / IP / TCP 172.21.174.213:41220 > 151.101.0.223:https A
2026-01-26 06:23:26,755 | INFO | WIRESHARK | Ether / IP / TCP 151.101.0.223:https > 172.21.174.213:41220 
2026-01-26 06:23:26,756 | INFO | WIRESHARK | Ether / IP / TCP 151.101.0.223:https > 172.21.174.213:41220 A / Raw
2026-01-26 06:23:26,788 | INFO | WIRESHARK | Ether / IP / TCP 151.101.0.223:https > 172.21.174.213:41220 
2026-01-26 06:23:26,789 | INFO | WIRESHARK | Ether / IP / TCP 151.101.0.223:https > 172.21.174.213:41220 A / Raw
2026-01-26 06:23:26,792 | INFO | WIRESHARK | Ether / IP / TCP 172.21.174.213:41220 > 151.101.0.223:https 
2026-01-26 06:23:26,795 | INFO | WIRESHARK | Ether / IP / TCP 172.21.174.213:41220 > 151.101.0.223:https A
2026-01-26 06:23:26,798 | INFO | WIRESHARK | Ether / IP / TCP 151.101.0.223:https > 172.21.174.213:41220 
2026-01-26 06:23:26,802 | INFO | WIRESHARK | Ether / IP / TCP 151.101.0.223:https > 172.21.174.213:41220 PA / Raw
2026-01-26 06:23:26,804 | INFO | WIRESHARK | Ether / IP / TCP 172.21.174.213:41220 > 151.101.0.223:https 
2026-01-26 06:23:26,806 | INFO | WIRESHARK | Ether / IP / TCP 172.21.174.213:41220 > 151.101.0.223:https A
2026-01-26 06:23:26,809 | INFO | WIRESHARK | Ether / IP / TCP 151.101.0.223:https > 172.21.174.213:41220 
2026-01-26 06:23:26,812 | INFO | WIRESHARK | Ether / IP / TCP 151.101.0.223:https > 172.21.174.213:41220 A / Raw
2026-01-26 06:23:26,848 | INFO | WIRESHARK | Ether / IP / TCP 172.21.174.213:41220 > 151.101.0.223:https A
2026-01-26 06:23:26,849 | INFO | WIRESHARK | Ether / IP / TCP 172.21.174.213:41220 > 151.101.0.223:https 
2026-01-26 06:23:26,852 | INFO | WIRESHARK | Ether / IP / TCP 151.101.0.223:https > 172.21.174.213:41220 A / Raw
2026-01-26 06:23:26,855 | INFO | WIRESHARK | Ether / IP / TCP 151.101.0.223:https > 172.21.174.213:41220 
2026-01-26 06:23:26,857 | INFO | WIRESHARK | Ether / IP / TCP 151.101.0.223:https > 172.21.174.213:41220 PA / Raw
2026-01-26 06:23:26,860 | INFO | WIRESHARK | Ether / IP / TCP 151.101.0.223:https > 172.21.174.213:41220 
2026-01-26 06:23:26,862 | INFO | WIRESHARK | Ether / IP / TCP 172.21.174.213:41220 > 151.101.0.223:https A
2026-01-26 06:23:26,865 | INFO | WIRESHARK | Ether / IP / TCP 172.21.174.213:41220 > 151.101.0.223:https 
2026-01-26 06:23:26,868 | INFO | WIRESHARK | Ether / IP / TCP 151.101.0.223:https > 172.21.174.213:41220 PA / Raw
2026-01-26 06:23:26,871 | INFO | WIRESHARK | Ether / IP / TCP 151.101.0.223:https > 172.21.174.213:41220 
2026-01-26 06:23:26,873 | INFO | WIRESHARK | Ether / IP / TCP 172.21.174.213:41220 > 151.101.0.223:https A
2026-01-26 06:23:26,876 | INFO | WIRESHARK | Ether / IP / TCP 172.21.174.213:41220 > 151.101.0.223:https 
2026-01-26 06:23:26,914 | INFO | WIRESHARK | Ether / IP / TCP 151.101.0.223:https > 172.21.174.213:41220 
2026-01-26 06:23:26,915 | INFO | WIRESHARK | Ether / IP / TCP 151.101.0.223:https > 172.21.174.213:41220 A / Raw
2026-01-26 06:23:26,919 | INFO | WIRESHARK | Ether / IP / TCP 151.101.0.223:https > 172.21.174.213:41220 
2026-01-26 06:23:26,923 | INFO | WIRESHARK | Ether / IP / TCP 151.101.0.223:https > 172.21.174.213:41220 PA / Raw
2026-01-26 06:23:26,926 | INFO | WIRESHARK | Ether / IP / TCP 172.21.174.213:41220 > 151.101.0.223:https 
2026-01-26 06:23:26,929 | INFO | WIRESHARK | Ether / IP / TCP 172.21.174.213:41220 > 151.101.0.223:https A
2026-01-26 06:23:26,945 | INFO | WIRESHARK | Ether / IP / TCP 151.101.0.223:https > 172.21.174.213:41220 
2026-01-26 06:23:26,946 | INFO | WIRESHARK | Ether / IP / TCP 151.101.0.223:https > 172.21.174.213:41220 PA / Raw
2026-01-26 06:23:26,949 | INFO | WIRESHARK | Ether / IP / TCP 172.21.174.213:41220 > 151.101.0.223:https 
2026-01-26 06:23:26,952 | INFO | WIRESHARK | Ether / IP / TCP 172.21.174.213:41220 > 151.101.0.223:https A
2026-01-26 06:23:26,983 | INFO | WIRESHARK | Ether / IP / TCP 151.101.0.223:https > 172.21.174.213:41220 PA / Raw
2026-01-26 06:23:26,984 | INFO | WIRESHARK | Ether / IP / TCP 151.101.0.223:https > 172.21.174.213:41220 
2026-01-26 06:23:26,987 | INFO | WIRESHARK | Ether / IP / TCP 172.21.174.213:41220 > 151.101.0.223:https A
2026-01-26 06:23:26,990 | INFO | WIRESHARK | Ether / IP / TCP 172.21.174.213:41220 > 151.101.0.223:https 
2026-01-26 06:23:27,008 | INFO | WIRESHARK | Ether / IP / TCP 151.101.0.223:https > 172.21.174.213:41220 
2026-01-26 06:23:27,009 | INFO | WIRESHARK | Ether / IP / TCP 151.101.0.223:https > 172.21.174.213:41220 PA / Raw
2026-01-26 06:23:27,013 | INFO | WIRESHARK | Ether / IP / TCP 172.21.174.213:41220 > 151.101.0.223:https 
2026-01-26 06:23:27,015 | INFO | WIRESHARK | Ether / IP / TCP 172.21.174.213:41220 > 151.101.0.223:https A
2026-01-26 06:23:27,020 | INFO | WIRESHARK | Ether / IP / TCP 151.101.0.223:https > 172.21.174.213:41220 
2026-01-26 06:23:27,021 | INFO | WIRESHARK | Ether / IP / TCP 151.101.0.223:https > 172.21.174.213:41220 A / Raw
2026-01-26 06:23:27,048 | INFO | WIRESHARK | Ether / IP / TCP 151.101.0.223:https > 172.21.174.213:41220 
2026-01-26 06:23:27,050 | INFO | WIRESHARK | Ether / IP / TCP 151.101.0.223:https > 172.21.174.213:41220 PA / Raw
2026-01-26 06:23:27,053 | INFO | WIRESHARK | Ether / IP / TCP 172.21.174.213:41220 > 151.101.0.223:https 
2026-01-26 06:23:27,057 | INFO | WIRESHARK | Ether / IP / TCP 172.21.174.213:41220 > 151.101.0.223:https A
2026-01-26 06:23:27,074 | INFO | WIRESHARK | Ether / IP / TCP 151.101.0.223:https > 172.21.174.213:41220 
2026-01-26 06:23:27,075 | INFO | WIRESHARK | Ether / IP / TCP 151.101.0.223:https > 172.21.174.213:41220 A / Raw
2026-01-26 06:23:27,078 | INFO | WIRESHARK | Ether / IP / TCP 151.101.0.223:https > 172.21.174.213:41220 
2026-01-26 06:23:27,081 | INFO | WIRESHARK | Ether / IP / TCP 151.101.0.223:https > 172.21.174.213:41220 PA / Raw
2026-01-26 06:23:27,084 | INFO | WIRESHARK | Ether / IP / TCP 172.21.174.213:41220 > 151.101.0.223:https 
2026-01-26 06:23:27,087 | INFO | WIRESHARK | Ether / IP / TCP 172.21.174.213:41220 > 151.101.0.223:https A
2026-01-26 06:23:27,113 | INFO | WIRESHARK | Ether / IP / TCP 151.101.0.223:https > 172.21.174.213:41220 
2026-01-26 06:23:27,115 | INFO | WIRESHARK | Ether / IP / TCP 151.101.0.223:https > 172.21.174.213:41220 PA / Raw
2026-01-26 06:23:27,118 | INFO | WIRESHARK | Ether / IP / TCP 172.21.174.213:41220 > 151.101.0.223:https 
2026-01-26 06:23:27,120 | INFO | WIRESHARK | Ether / IP / TCP 172.21.174.213:41220 > 151.101.0.223:https A
2026-01-26 06:23:27,124 | INFO | WIRESHARK | Ether / IP / TCP 151.101.0.223:https > 172.21.174.213:41220 
2026-01-26 06:23:27,126 | INFO | WIRESHARK | Ether / IP / TCP 151.101.0.223:https > 172.21.174.213:41220 A / Raw
2026-01-26 06:23:27,135 | INFO | WIRESHARK | Ether / IP / TCP 151.101.0.223:https > 172.21.174.213:41220 
2026-01-26 06:23:27,136 | INFO | WIRESHARK | Ether / IP / TCP 151.101.0.223:https > 172.21.174.213:41220 PA / Raw
2026-01-26 06:23:27,139 | INFO | WIRESHARK | Ether / IP / TCP 172.21.174.213:41220 > 151.101.0.223:https 
2026-01-26 06:23:27,142 | INFO | WIRESHARK | Ether / IP / TCP 172.21.174.213:41220 > 151.101.0.223:https A
2026-01-26 06:23:27,144 | INFO | WIRESHARK | Ether / IP / TCP 151.101.0.223:https > 172.21.174.213:41220 
2026-01-26 06:23:27,147 | INFO | WIRESHARK | Ether / IP / TCP 151.101.0.223:https > 172.21.174.213:41220 A / Raw
2026-01-26 06:23:27,184 | INFO | WIRESHARK | Ether / IP / TCP 172.21.174.213:41220 > 151.101.0.223:https 
2026-01-26 06:23:27,185 | INFO | WIRESHARK | Ether / IP / TCP 172.21.174.213:41220 > 151.101.0.223:https A
2026-01-26 06:23:27,200 | INFO | WIRESHARK | Ether / IP / TCP 151.101.0.223:https > 172.21.174.213:41220 PA / Raw
2026-01-26 06:23:27,201 | INFO | WIRESHARK | Ether / IP / TCP 151.101.0.223:https > 172.21.174.213:41220 
2026-01-26 06:23:27,206 | INFO | WIRESHARK | Ether / IP / TCP 172.21.174.213:41220 > 151.101.0.223:https A
2026-01-26 06:23:27,209 | INFO | WIRESHARK | Ether / IP / TCP 172.21.174.213:41220 > 151.101.0.223:https 
2026-01-26 06:23:27,253 | INFO | WIRESHARK | Ether / IP / TCP 151.101.0.223:https > 172.21.174.213:41220 
2026-01-26 06:23:27,257 | INFO | WIRESHARK | Ether / IP / TCP 172.21.174.213:41220 > 151.101.0.223:https 
2026-01-26 06:23:27,254 | INFO | WIRESHARK | Ether / IP / TCP 151.101.0.223:https > 172.21.174.213:41220 PA / Raw
2026-01-26 06:23:27,262 | INFO | WIRESHARK | Ether / IP / TCP 172.21.174.213:41220 > 151.101.0.223:https A
2026-01-26 06:23:27,268 | INFO | WIRESHARK | Ether / IP / TCP 151.101.0.223:https > 172.21.174.213:41220 A / Raw
2026-01-26 06:23:27,272 | INFO | WIRESHARK | Ether / IP / TCP 172.21.174.213:41220 > 151.101.0.223:https A
2026-01-26 06:23:27,275 | INFO | WIRESHARK | Ether / IP / TCP 151.101.0.223:https > 172.21.174.213:41220 A / Raw
2026-01-26 06:23:27,278 | INFO | WIRESHARK | Ether / IP / TCP 172.21.174.213:41220 > 151.101.0.223:https A
2026-01-26 06:23:27,264 | INFO | WIRESHARK | Ether / IP / TCP 151.101.0.223:https > 172.21.174.213:41220 
2026-01-26 06:23:27,283 | INFO | WIRESHARK | Ether / IP / TCP 172.21.174.213:41220 > 151.101.0.223:https 
2026-01-26 06:23:27,286 | INFO | WIRESHARK | Ether / IP / TCP 151.101.0.223:https > 172.21.174.213:41220 
2026-01-26 06:23:27,288 | INFO | WIRESHARK | Ether / IP / TCP 172.21.174.213:41220 > 151.101.0.223:https 
2026-01-26 06:23:27,322 | INFO | WIRESHARK | Ether / IP / TCP 151.101.0.223:https > 172.21.174.213:41220 
2026-01-26 06:23:27,326 | INFO | WIRESHARK | Ether / IP / TCP 151.101.0.223:https > 172.21.174.213:41220 
2026-01-26 06:23:27,323 | INFO | WIRESHARK | Ether / IP / TCP 151.101.0.223:https > 172.21.174.213:41220 A / Raw
2026-01-26 06:23:27,332 | INFO | WIRESHARK | Ether / IP / TCP 151.101.0.223:https > 172.21.174.213:41220 A / Raw
2026-01-26 06:23:27,336 | INFO | WIRESHARK | Ether / IP / TCP 172.21.174.213:41220 > 151.101.0.223:https A
2026-01-26 06:23:27,329 | INFO | WIRESHARK | Ether / IP / TCP 172.21.174.213:41220 > 151.101.0.223:https 
2026-01-26 06:23:27,340 | INFO | WIRESHARK | Ether / IP / TCP 151.101.0.223:https > 172.21.174.213:41220 A / Raw
2026-01-26 06:23:27,343 | INFO | WIRESHARK | Ether / IP / TCP 151.101.0.223:https > 172.21.174.213:41220 
2026-01-26 06:23:27,345 | INFO | WIRESHARK | Ether / IP / TCP 172.21.174.213:41220 > 151.101.0.223:https A
2026-01-26 06:23:27,347 | INFO | WIRESHARK | Ether / IP / TCP 172.21.174.213:41220 > 151.101.0.223:https 
2026-01-26 06:23:27,350 | INFO | WIRESHARK | Ether / IP / TCP 151.101.0.223:https > 172.21.174.213:41220 A / Raw
2026-01-26 06:23:27,352 | INFO | WIRESHARK | Ether / IP / TCP 151.101.0.223:https > 172.21.174.213:41220 
2026-01-26 06:23:27,384 | INFO | WIRESHARK | Ether / IP / TCP 172.21.174.213:41220 > 151.101.0.223:https 
2026-01-26 06:23:27,386 | INFO | WIRESHARK | Ether / IP / TCP 172.21.174.213:41220 > 151.101.0.223:https A
2026-01-26 06:23:27,388 | INFO | WIRESHARK | Ether / IP / TCP 151.101.0.223:https > 172.21.174.213:41220 
2026-01-26 06:23:27,391 | INFO | WIRESHARK | Ether / IP / TCP 151.101.0.223:https > 172.21.174.213:41220 A / Raw
2026-01-26 06:23:27,402 | INFO | WIRESHARK | Ether / IP / TCP 151.101.0.223:https > 172.21.174.213:41220 
2026-01-26 06:23:27,403 | INFO | WIRESHARK | Ether / IP / TCP 151.101.0.223:https > 172.21.174.213:41220 PA / Raw
2026-01-26 06:23:27,406 | INFO | WIRESHARK | Ether / IP / TCP 172.21.174.213:41220 > 151.101.0.223:https 
2026-01-26 06:23:27,410 | INFO | WIRESHARK | Ether / IP / TCP 172.21.174.213:41220 > 151.101.0.223:https A
2026-01-26 06:23:27,450 | INFO | WIRESHARK | Ether / IP / TCP 151.101.0.223:https > 172.21.174.213:41220 
2026-01-26 06:23:27,451 | INFO | WIRESHARK | Ether / IP / TCP 151.101.0.223:https > 172.21.174.213:41220 PA / Raw
2026-01-26 06:23:27,454 | INFO | WIRESHARK | Ether / IP / TCP 172.21.174.213:41220 > 151.101.0.223:https 
2026-01-26 06:23:27,457 | INFO | WIRESHARK | Ether / IP / TCP 172.21.174.213:41220 > 151.101.0.223:https A
2026-01-26 06:23:27,468 | INFO | WIRESHARK | Ether / IP / TCP 151.101.0.223:https > 172.21.174.213:41220 
2026-01-26 06:23:27,469 | INFO | WIRESHARK | Ether / IP / TCP 151.101.0.223:https > 172.21.174.213:41220 PA / Raw
2026-01-26 06:23:27,472 | INFO | WIRESHARK | Ether / IP / TCP 172.21.174.213:41220 > 151.101.0.223:https 
2026-01-26 06:23:27,475 | INFO | WIRESHARK | Ether / IP / TCP 172.21.174.213:41220 > 151.101.0.223:https A
2026-01-26 06:23:27,488 | INFO | WIRESHARK | Ether / IP / TCP 151.101.0.223:https > 172.21.174.213:41220 A / Raw
2026-01-26 06:23:27,489 | INFO | WIRESHARK | Ether / IP / TCP 151.101.0.223:https > 172.21.174.213:41220 
2026-01-26 06:23:27,515 | INFO | WIRESHARK | Ether / IP / TCP 151.101.0.223:https > 172.21.174.213:41220 
2026-01-26 06:23:27,516 | INFO | WIRESHARK | Ether / IP / TCP 151.101.0.223:https > 172.21.174.213:41220 PA / Raw
2026-01-26 06:23:27,519 | INFO | WIRESHARK | Ether / IP / TCP 172.21.174.213:41220 > 151.101.0.223:https 
2026-01-26 06:23:27,522 | INFO | WIRESHARK | Ether / IP / TCP 172.21.174.213:41220 > 151.101.0.223:https A
2026-01-26 06:23:27,533 | INFO | WIRESHARK | Ether / IP / TCP 151.101.0.223:https > 172.21.174.213:41220 PA / Raw
2026-01-26 06:23:27,534 | INFO | WIRESHARK | Ether / IP / TCP 151.101.0.223:https > 172.21.174.213:41220 
2026-01-26 06:23:27,537 | INFO | WIRESHARK | Ether / IP / TCP 172.21.174.213:41220 > 151.101.0.223:https A
2026-01-26 06:23:27,539 | INFO | WIRESHARK | Ether / IP / TCP 172.21.174.213:41220 > 151.101.0.223:https 
2026-01-26 06:23:27,590 | INFO | WIRESHARK | Ether / IP / TCP 151.101.0.223:https > 172.21.174.213:41220 
2026-01-26 06:23:27,596 | INFO | WIRESHARK | Ether / IP / TCP 172.21.174.213:41220 > 151.101.0.223:https 
2026-01-26 06:23:27,592 | INFO | WIRESHARK | Ether / IP / TCP 151.101.0.223:https > 172.21.174.213:41220 A / Raw
2026-01-26 06:23:27,600 | INFO | WIRESHARK | Ether / IP / TCP 151.101.0.223:https > 172.21.174.213:41220 
2026-01-26 06:23:27,606 | INFO | WIRESHARK | Ether / IP / TCP 172.21.174.213:41220 > 151.101.0.223:https 
2026-01-26 06:23:27,602 | INFO | WIRESHARK | Ether / IP / TCP 172.21.174.213:41220 > 151.101.0.223:https A
2026-01-26 06:23:27,612 | INFO | WIRESHARK | Ether / IP / TCP 151.101.0.223:https > 172.21.174.213:41220 PA / Raw
2026-01-26 06:23:27,615 | INFO | WIRESHARK | Ether / IP / TCP 172.21.174.213:41220 > 151.101.0.223:https A
2026-01-26 06:23:27,621 | INFO | WIRESHARK | Ether / IP / TCP 151.101.0.223:https > 172.21.174.213:41220 
2026-01-26 06:23:27,622 | INFO | WIRESHARK | Ether / IP / TCP 151.101.0.223:https > 172.21.174.213:41220 A / Raw
2026-01-26 06:23:27,625 | INFO | WIRESHARK | Ether / IP / TCP 172.21.174.213:41220 > 151.101.0.223:https 
2026-01-26 06:23:27,628 | INFO | WIRESHARK | Ether / IP / TCP 172.21.174.213:41220 > 151.101.0.223:https A
2026-01-26 06:23:27,655 | INFO | WIRESHARK | Ether / IP / TCP 151.101.0.223:https > 172.21.174.213:41220 
2026-01-26 06:23:27,656 | INFO | WIRESHARK | Ether / IP / TCP 151.101.0.223:https > 172.21.174.213:41220 A / Raw
2026-01-26 06:23:27,659 | INFO | WIRESHARK | Ether / IP / TCP 172.21.174.213:41220 > 151.101.0.223:https 
2026-01-26 06:23:27,661 | INFO | WIRESHARK | Ether / IP / TCP 172.21.174.213:41220 > 151.101.0.223:https A
2026-01-26 06:23:27,665 | INFO | WIRESHARK | Ether / IP / TCP 151.101.0.223:https > 172.21.174.213:41220 
2026-01-26 06:23:27,668 | INFO | WIRESHARK | Ether / IP / TCP 151.101.0.223:https > 172.21.174.213:41220 A / Raw
2026-01-26 06:23:27,671 | INFO | WIRESHARK | Ether / IP / TCP 172.21.174.213:41220 > 151.101.0.223:https 
2026-01-26 06:23:27,674 | INFO | WIRESHARK | Ether / IP / TCP 172.21.174.213:41220 > 151.101.0.223:https A
2026-01-26 06:23:27,678 | INFO | WIRESHARK | Ether / IP / TCP 151.101.0.223:https > 172.21.174.213:41220 
2026-01-26 06:23:27,681 | INFO | WIRESHARK | Ether / IP / TCP 151.101.0.223:https > 172.21.174.213:41220 A / Raw
2026-01-26 06:23:27,683 | INFO | WIRESHARK | Ether / IP / TCP 172.21.174.213:41220 > 151.101.0.223:https 
2026-01-26 06:23:27,686 | INFO | WIRESHARK | Ether / IP / TCP 172.21.174.213:41220 > 151.101.0.223:https A
2026-01-26 06:23:27,689 | INFO | WIRESHARK | Ether / IP / TCP 151.101.0.223:https > 172.21.174.213:41220 
2026-01-26 06:23:27,691 | INFO | WIRESHARK | Ether / IP / TCP 151.101.0.223:https > 172.21.174.213:41220 A / Raw
2026-01-26 06:23:27,721 | INFO | WIRESHARK | Ether / IP / TCP 151.101.0.223:https > 172.21.174.213:41220 
2026-01-26 06:23:27,723 | INFO | WIRESHARK | Ether / IP / TCP 151.101.0.223:https > 172.21.174.213:41220 A / Raw
2026-01-26 06:23:27,726 | INFO | WIRESHARK | Ether / IP / TCP 172.21.174.213:41220 > 151.101.0.223:https 
2026-01-26 06:23:27,729 | INFO | WIRESHARK | Ether / IP / TCP 172.21.174.213:41220 > 151.101.0.223:https A
2026-01-26 06:23:27,732 | INFO | WIRESHARK | Ether / IP / TCP 151.101.0.223:https > 172.21.174.213:41220 
2026-01-26 06:23:27,735 | INFO | WIRESHARK | Ether / IP / TCP 151.101.0.223:https > 172.21.174.213:41220 A / Raw
2026-01-26 06:23:27,737 | INFO | WIRESHARK | Ether / IP / TCP 151.101.0.223:https > 172.21.174.213:41220 
2026-01-26 06:23:27,740 | INFO | WIRESHARK | Ether / IP / TCP 151.101.0.223:https > 172.21.174.213:41220 A / Raw
2026-01-26 06:23:27,744 | INFO | WIRESHARK | Ether / IP / TCP 172.21.174.213:41220 > 151.101.0.223:https 
2026-01-26 06:23:27,746 | INFO | WIRESHARK | Ether / IP / TCP 172.21.174.213:41220 > 151.101.0.223:https A
2026-01-26 06:23:27,787 | INFO | WIRESHARK | Ether / IP / TCP 151.101.0.223:https > 172.21.174.213:41220 
2026-01-26 06:23:27,788 | INFO | WIRESHARK | Ether / IP / TCP 151.101.0.223:https > 172.21.174.213:41220 PA / Raw
2026-01-26 06:23:27,792 | INFO | WIRESHARK | Ether / IP / TCP 172.21.174.213:41220 > 151.101.0.223:https 
2026-01-26 06:23:27,794 | INFO | WIRESHARK | Ether / IP / TCP 172.21.174.213:41220 > 151.101.0.223:https A
2026-01-26 06:23:27,803 | INFO | WIRESHARK | Ether / IP / TCP 151.101.0.223:https > 172.21.174.213:41220 PA / Raw
2026-01-26 06:23:27,804 | INFO | WIRESHARK | Ether / IP / TCP 151.101.0.223:https > 172.21.174.213:41220 
2026-01-26 06:23:27,808 | INFO | WIRESHARK | Ether / IP / TCP 172.21.174.213:41220 > 151.101.0.223:https A
2026-01-26 06:23:27,811 | INFO | WIRESHARK | Ether / IP / TCP 172.21.174.213:41220 > 151.101.0.223:https 
2026-01-26 06:23:27,827 | INFO | WIRESHARK | Ether / IP / TCP 151.101.0.223:https > 172.21.174.213:41220 
2026-01-26 06:23:27,829 | INFO | WIRESHARK | Ether / IP / TCP 151.101.0.223:https > 172.21.174.213:41220 A / Raw
2026-01-26 06:23:27,851 | INFO | WIRESHARK | Ether / IP / TCP 151.101.0.223:https > 172.21.174.213:41220 
2026-01-26 06:23:27,852 | INFO | WIRESHARK | Ether / IP / TCP 151.101.0.223:https > 172.21.174.213:41220 PA / Raw
2026-01-26 06:23:27,854 | INFO | WIRESHARK | Ether / IP / TCP 172.21.174.213:41220 > 151.101.0.223:https 
2026-01-26 06:23:27,857 | INFO | WIRESHARK | Ether / IP / TCP 172.21.174.213:41220 > 151.101.0.223:https A
2026-01-26 06:23:28,071 | INFO | METRIC | CPU: 3.6% | PKTS: 4081
2026-01-26 06:23:28,101 | INFO | WIRESHARK | Ether / IP / TCP 172.21.174.213:40420 > 167.82.56.223:https 
2026-01-26 06:23:28,102 | INFO | WIRESHARK | Ether / IP / TCP 172.21.174.213:40420 > 167.82.56.223:https PA / Raw
2026-01-26 06:23:28,178 | INFO | WIRESHARK | Ether / IP / TCP 167.82.56.223:https > 172.21.174.213:40420 
2026-01-26 06:23:28,180 | INFO | WIRESHARK | Ether / IP / TCP 167.82.56.223:https > 172.21.174.213:40420 A
2026-01-26 06:23:28,184 | INFO | WIRESHARK | Ether / IP / TCP 167.82.56.223:https > 172.21.174.213:40420 
2026-01-26 06:23:28,188 | INFO | WIRESHARK | Ether / IP / TCP 167.82.56.223:https > 172.21.174.213:40420 PA / Raw
2026-01-26 06:23:28,191 | INFO | WIRESHARK | Ether / IP / TCP 172.21.174.213:40420 > 167.82.56.223:https 
2026-01-26 06:23:28,194 | INFO | WIRESHARK | Ether / IP / TCP 172.21.174.213:40420 > 167.82.56.223:https A
2026-01-26 06:23:28,202 | INFO | WIRESHARK | Ether / IP / TCP 167.82.56.223:https > 172.21.174.213:40420 A / Raw
2026-01-26 06:23:28,202 | INFO | WIRESHARK | Ether / IP / TCP 167.82.56.223:https > 172.21.174.213:40420 
2026-01-26 06:23:28,205 | INFO | WIRESHARK | Ether / IP / TCP 172.21.174.213:40420 > 167.82.56.223:https A
2026-01-26 06:23:28,208 | INFO | WIRESHARK | Ether / IP / TCP 172.21.174.213:40420 > 167.82.56.223:https 
2026-01-26 06:23:28,232 | INFO | WIRESHARK | Ether / IP / TCP 167.82.56.223:https > 172.21.174.213:40420 
2026-01-26 06:23:28,233 | INFO | WIRESHARK | Ether / IP / TCP 167.82.56.223:https > 172.21.174.213:40420 A / Raw
2026-01-26 06:23:28,236 | INFO | WIRESHARK | Ether / IP / TCP 172.21.174.213:40420 > 167.82.56.223:https 
2026-01-26 06:23:28,239 | INFO | WIRESHARK | Ether / IP / TCP 172.21.174.213:40420 > 167.82.56.223:https A
2026-01-26 06:23:28,258 | INFO | WIRESHARK | Ether / IP / TCP 167.82.56.223:https > 172.21.174.213:40420 A / Raw
2026-01-26 06:23:28,259 | INFO | WIRESHARK | Ether / IP / TCP 167.82.56.223:https > 172.21.174.213:40420 
2026-01-26 06:23:28,268 | INFO | WIRESHARK | Ether / IP / TCP 172.21.174.213:40420 > 167.82.56.223:https A
2026-01-26 06:23:28,271 | INFO | WIRESHARK | Ether / IP / TCP 172.21.174.213:40420 > 167.82.56.223:https 
2026-01-26 06:23:28,276 | INFO | WIRESHARK | Ether / IP / TCP 167.82.56.223:https > 172.21.174.213:40420 
2026-01-26 06:23:28,277 | INFO | WIRESHARK | Ether / IP / TCP 167.82.56.223:https > 172.21.174.213:40420 A / Raw
2026-01-26 06:23:28,279 | INFO | WIRESHARK | Ether / IP / TCP 172.21.174.213:40420 > 167.82.56.223:https 
2026-01-26 06:23:28,281 | INFO | WIRESHARK | Ether / IP / TCP 172.21.174.213:40420 > 167.82.56.223:https A
2026-01-26 06:23:28,308 | INFO | WIRESHARK | Ether / IP / TCP 167.82.56.223:https > 172.21.174.213:40420 
2026-01-26 06:23:28,309 | INFO | WIRESHARK | Ether / IP / TCP 167.82.56.223:https > 172.21.174.213:40420 A / Raw
2026-01-26 06:23:28,312 | INFO | WIRESHARK | Ether / IP / TCP 172.21.174.213:40420 > 167.82.56.223:https 
2026-01-26 06:23:28,316 | INFO | WIRESHARK | Ether / IP / TCP 172.21.174.213:40420 > 167.82.56.223:https A
2026-01-26 06:23:28,333 | INFO | WIRESHARK | Ether / IP / TCP 167.82.56.223:https > 172.21.174.213:40420 A / Raw
2026-01-26 06:23:28,334 | INFO | WIRESHARK | Ether / IP / TCP 167.82.56.223:https > 172.21.174.213:40420 
2026-01-26 06:23:28,338 | INFO | WIRESHARK | Ether / IP / TCP 172.21.174.213:40420 > 167.82.56.223:https A
2026-01-26 06:23:28,341 | INFO | WIRESHARK | Ether / IP / TCP 172.21.174.213:40420 > 167.82.56.223:https 
2026-01-26 06:23:28,352 | INFO | WIRESHARK | Ether / IP / TCP 167.82.56.223:https > 172.21.174.213:40420 A / Raw
2026-01-26 06:23:28,353 | INFO | WIRESHARK | Ether / IP / TCP 167.82.56.223:https > 172.21.174.213:40420 
2026-01-26 06:23:28,356 | INFO | WIRESHARK | Ether / IP / TCP 172.21.174.213:40420 > 167.82.56.223:https A
2026-01-26 06:23:28,360 | INFO | WIRESHARK | Ether / IP / TCP 172.21.174.213:40420 > 167.82.56.223:https 
2026-01-26 06:23:28,383 | INFO | WIRESHARK | Ether / IP / TCP 167.82.56.223:https > 172.21.174.213:40420 
2026-01-26 06:23:28,385 | INFO | WIRESHARK | Ether / IP / TCP 167.82.56.223:https > 172.21.174.213:40420 A / Raw
2026-01-26 06:23:28,388 | INFO | WIRESHARK | Ether / IP / TCP 172.21.174.213:40420 > 167.82.56.223:https 
2026-01-26 06:23:28,391 | INFO | WIRESHARK | Ether / IP / TCP 172.21.174.213:40420 > 167.82.56.223:https A
2026-01-26 06:23:28,408 | INFO | WIRESHARK | Ether / IP / TCP 167.82.56.223:https > 172.21.174.213:40420 A / Raw
2026-01-26 06:23:28,410 | INFO | WIRESHARK | Ether / IP / TCP 167.82.56.223:https > 172.21.174.213:40420 
2026-01-26 06:23:28,412 | INFO | WIRESHARK | Ether / IP / TCP 172.21.174.213:40420 > 167.82.56.223:https A
2026-01-26 06:23:28,415 | INFO | WIRESHARK | Ether / IP / TCP 172.21.174.213:40420 > 167.82.56.223:https 
2026-01-26 06:23:28,427 | INFO | WIRESHARK | Ether / IP / TCP 167.82.56.223:https > 172.21.174.213:40420 
2026-01-26 06:23:28,429 | INFO | WIRESHARK | Ether / IP / TCP 167.82.56.223:https > 172.21.174.213:40420 PA / Raw
2026-01-26 06:23:28,432 | INFO | WIRESHARK | Ether / IP / TCP 172.21.174.213:40420 > 167.82.56.223:https 
2026-01-26 06:23:28,436 | INFO | WIRESHARK | Ether / IP / TCP 172.21.174.213:40420 > 167.82.56.223:https A
2026-01-26 06:23:28,460 | INFO | WIRESHARK | Ether / IP / TCP 167.82.56.223:https > 172.21.174.213:40420 
2026-01-26 06:23:28,462 | INFO | WIRESHARK | Ether / IP / TCP 167.82.56.223:https > 172.21.174.213:40420 A / Raw
2026-01-26 06:23:28,465 | INFO | WIRESHARK | Ether / IP / TCP 172.21.174.213:40420 > 167.82.56.223:https 
2026-01-26 06:23:28,468 | INFO | WIRESHARK | Ether / IP / TCP 172.21.174.213:40420 > 167.82.56.223:https A
2026-01-26 06:23:28,483 | INFO | WIRESHARK | Ether / IP / TCP 167.82.56.223:https > 172.21.174.213:40420 
2026-01-26 06:23:28,484 | INFO | WIRESHARK | Ether / IP / TCP 167.82.56.223:https > 172.21.174.213:40420 A / Raw
2026-01-26 06:23:28,487 | INFO | WIRESHARK | Ether / IP / TCP 172.21.174.213:40420 > 167.82.56.223:https 
2026-01-26 06:23:28,490 | INFO | WIRESHARK | Ether / IP / TCP 172.21.174.213:40420 > 167.82.56.223:https A
2026-01-26 06:23:28,502 | INFO | WIRESHARK | Ether / IP / TCP 167.82.56.223:https > 172.21.174.213:40420 A / Raw
2026-01-26 06:23:28,503 | INFO | WIRESHARK | Ether / IP / TCP 167.82.56.223:https > 172.21.174.213:40420 
2026-01-26 06:23:28,506 | INFO | WIRESHARK | Ether / IP / TCP 172.21.174.213:40420 > 167.82.56.223:https A
2026-01-26 06:23:28,510 | INFO | WIRESHARK | Ether / IP / TCP 172.21.174.213:40420 > 167.82.56.223:https 
2026-01-26 06:23:28,514 | INFO | WIRESHARK | Ether / IP / TCP 167.82.56.223:https > 172.21.174.213:40420 PA / Raw
2026-01-26 06:23:28,517 | INFO | WIRESHARK | Ether / IP / TCP 167.82.56.223:https > 172.21.174.213:40420 
2026-01-26 06:23:28,522 | INFO | WIRESHARK | Ether / IP / TCP 172.21.174.213:40420 > 167.82.56.223:https A
2026-01-26 06:23:28,527 | INFO | WIRESHARK | Ether / IP / TCP 172.21.174.213:40420 > 167.82.56.223:https 
2026-01-26 06:23:28,537 | INFO | WIRESHARK | Ether / IP / TCP 167.82.56.223:https > 172.21.174.213:40420 A / Raw
2026-01-26 06:23:28,539 | INFO | WIRESHARK | Ether / IP / TCP 167.82.56.223:https > 172.21.174.213:40420 
2026-01-26 06:23:28,542 | INFO | WIRESHARK | Ether / IP / TCP 172.21.174.213:40420 > 167.82.56.223:https A
2026-01-26 06:23:28,545 | INFO | WIRESHARK | Ether / IP / TCP 172.21.174.213:40420 > 167.82.56.223:https 
2026-01-26 06:23:28,561 | INFO | WIRESHARK | Ether / IP / TCP 167.82.56.223:https > 172.21.174.213:40420 
2026-01-26 06:23:28,562 | INFO | WIRESHARK | Ether / IP / TCP 167.82.56.223:https > 172.21.174.213:40420 A / Raw
2026-01-26 06:23:28,608 | INFO | WIRESHARK | Ether / IP / TCP 172.21.174.213:40420 > 167.82.56.223:https 
2026-01-26 06:23:28,613 | INFO | WIRESHARK | Ether / IP / TCP 167.82.56.223:https > 172.21.174.213:40420 
2026-01-26 06:23:28,617 | INFO | WIRESHARK | Ether / IP / TCP 172.21.174.213:40420 > 167.82.56.223:https 
2026-01-26 06:23:28,610 | INFO | WIRESHARK | Ether / IP / TCP 172.21.174.213:40420 > 167.82.56.223:https A
2026-01-26 06:23:28,622 | INFO | WIRESHARK | Ether / IP / TCP 167.82.56.223:https > 172.21.174.213:40420 PA / Raw
2026-01-26 06:23:28,624 | INFO | WIRESHARK | Ether / IP / TCP 172.21.174.213:40420 > 167.82.56.223:https A
2026-01-26 06:23:28,684 | INFO | WIRESHARK | Ether / IP / TCP 167.82.56.223:https > 172.21.174.213:40420 
2026-01-26 06:23:28,685 | INFO | WIRESHARK | Ether / IP / TCP 167.82.56.223:https > 172.21.174.213:40420 A / Raw
2026-01-26 06:23:28,690 | INFO | WIRESHARK | Ether / IP / TCP 172.21.174.213:40420 > 167.82.56.223:https 
2026-01-26 06:23:28,694 | INFO | WIRESHARK | Ether / IP / TCP 172.21.174.213:40420 > 167.82.56.223:https A
2026-01-26 06:23:28,698 | INFO | WIRESHARK | Ether / IP / TCP 167.82.56.223:https > 172.21.174.213:40420 
2026-01-26 06:23:28,701 | INFO | WIRESHARK | Ether / IP / TCP 167.82.56.223:https > 172.21.174.213:40420 PA / Raw
2026-01-26 06:23:28,705 | INFO | WIRESHARK | Ether / IP / TCP 172.21.174.213:40420 > 167.82.56.223:https 
2026-01-26 06:23:28,708 | INFO | WIRESHARK | Ether / IP / TCP 172.21.174.213:40420 > 167.82.56.223:https A
2026-01-26 06:23:28,760 | INFO | WIRESHARK | Ether / IP / TCP 167.82.56.223:https > 172.21.174.213:40420 
2026-01-26 06:23:28,761 | INFO | WIRESHARK | Ether / IP / TCP 167.82.56.223:https > 172.21.174.213:40420 A / Raw
2026-01-26 06:23:28,768 | INFO | WIRESHARK | Ether / IP / TCP 167.82.56.223:https > 172.21.174.213:40420 A / Raw
2026-01-26 06:23:28,774 | INFO | WIRESHARK | Ether / IP / TCP 172.21.174.213:40420 > 167.82.56.223:https A
2026-01-26 06:23:28,769 | INFO | WIRESHARK | Ether / IP / TCP 167.82.56.223:https > 172.21.174.213:40420 
2026-01-26 06:23:28,779 | INFO | WIRESHARK | Ether / IP / TCP 172.21.174.213:40420 > 167.82.56.223:https 
2026-01-26 06:23:28,791 | INFO | WIRESHARK | Ether / IP / TCP 167.82.56.223:https > 172.21.174.213:40420 
2026-01-26 06:23:28,792 | INFO | WIRESHARK | Ether / IP / TCP 167.82.56.223:https > 172.21.174.213:40420 A / Raw
2026-01-26 06:23:28,843 | INFO | WIRESHARK | Ether / IP / TCP 167.82.56.223:https > 172.21.174.213:40420 
2026-01-26 06:23:28,844 | INFO | WIRESHARK | Ether / IP / TCP 167.82.56.223:https > 172.21.174.213:40420 PA / Raw
2026-01-26 06:23:28,847 | INFO | WIRESHARK | Ether / IP / TCP 172.21.174.213:40420 > 167.82.56.223:https 
2026-01-26 06:23:28,850 | INFO | WIRESHARK | Ether / IP / TCP 172.21.174.213:40420 > 167.82.56.223:https A
2026-01-26 06:23:28,919 | INFO | WIRESHARK | Ether / IP / TCP 167.82.56.223:https > 172.21.174.213:40420 
2026-01-26 06:23:28,924 | INFO | WIRESHARK | Ether / IP / TCP 172.21.174.213:40420 > 167.82.56.223:https 
2026-01-26 06:23:28,921 | INFO | WIRESHARK | Ether / IP / TCP 167.82.56.223:https > 172.21.174.213:40420 PA / Raw
2026-01-26 06:23:28,931 | INFO | WIRESHARK | Ether / IP / TCP 172.21.174.213:40420 > 167.82.56.223:https A
2026-01-26 06:23:28,936 | INFO | WIRESHARK | Ether / IP / TCP 167.82.56.223:https > 172.21.174.213:40420 
2026-01-26 06:23:28,937 | INFO | WIRESHARK | Ether / IP / TCP 167.82.56.223:https > 172.21.174.213:40420 PA / Raw
2026-01-26 06:23:28,940 | INFO | WIRESHARK | Ether / IP / TCP 172.21.174.213:40420 > 167.82.56.223:https 
2026-01-26 06:23:28,943 | INFO | WIRESHARK | Ether / IP / TCP 172.21.174.213:40420 > 167.82.56.223:https A
2026-01-26 06:23:28,994 | INFO | WIRESHARK | Ether / IP / TCP 167.82.56.223:https > 172.21.174.213:40420 PA / Raw
2026-01-26 06:23:28,995 | INFO | WIRESHARK | Ether / IP / TCP 167.82.56.223:https > 172.21.174.213:40420 
2026-01-26 06:23:28,999 | INFO | WIRESHARK | Ether / IP / TCP 172.21.174.213:40420 > 167.82.56.223:https A
2026-01-26 06:23:29,002 | INFO | WIRESHARK | Ether / IP / TCP 172.21.174.213:40420 > 167.82.56.223:https 
2026-01-26 06:23:29,032 | INFO | WIRESHARK | Ether / IP / TCP 167.82.56.223:https > 172.21.174.213:40420 
2026-01-26 06:23:29,038 | INFO | WIRESHARK | Ether / IP / TCP 172.21.174.213:40420 > 167.82.56.223:https 
2026-01-26 06:23:29,034 | INFO | WIRESHARK | Ether / IP / TCP 167.82.56.223:https > 172.21.174.213:40420 A / Raw
2026-01-26 06:23:29,044 | INFO | WIRESHARK | Ether / IP / TCP 172.21.174.213:40420 > 167.82.56.223:https A
2026-01-26 06:23:29,070 | INFO | WIRESHARK | Ether / IP / TCP 167.82.56.223:https > 172.21.174.213:40420 
2026-01-26 06:23:29,072 | INFO | WIRESHARK | Ether / IP / TCP 167.82.56.223:https > 172.21.174.213:40420 A / Raw
2026-01-26 06:23:29,108 | INFO | WIRESHARK | Ether / IP / TCP 167.82.56.223:https > 172.21.174.213:40420 
2026-01-26 06:23:29,109 | INFO | WIRESHARK | Ether / IP / TCP 167.82.56.223:https > 172.21.174.213:40420 A / Raw
2026-01-26 06:23:29,111 | INFO | WIRESHARK | Ether / IP / TCP 172.21.174.213:40420 > 167.82.56.223:https 
2026-01-26 06:23:29,115 | INFO | WIRESHARK | Ether / IP / TCP 172.21.174.213:40420 > 167.82.56.223:https A
2026-01-26 06:23:29,184 | INFO | WIRESHARK | Ether / IP / TCP 167.82.56.223:https > 172.21.174.213:40420 
2026-01-26 06:23:29,186 | INFO | WIRESHARK | Ether / IP / TCP 167.82.56.223:https > 172.21.174.213:40420 A / Raw
2026-01-26 06:23:29,196 | INFO | WIRESHARK | Ether / IP / TCP 167.82.56.223:https > 172.21.174.213:40420 
2026-01-26 06:23:29,200 | INFO | WIRESHARK | Ether / IP / TCP 172.21.174.213:40420 > 167.82.56.223:https 
2026-01-26 06:23:29,197 | INFO | WIRESHARK | Ether / IP / TCP 167.82.56.223:https > 172.21.174.213:40420 A / Raw
2026-01-26 06:23:29,206 | INFO | WIRESHARK | Ether / IP / TCP 172.21.174.213:40420 > 167.82.56.223:https A
2026-01-26 06:23:29,220 | INFO | WIRESHARK | Ether / IP / TCP 167.82.56.223:https > 172.21.174.213:40420 
2026-01-26 06:23:29,222 | INFO | WIRESHARK | Ether / IP / TCP 167.82.56.223:https > 172.21.174.213:40420 A / Raw
2026-01-26 06:23:29,276 | INFO | WIRESHARK | Ether / IP / TCP 172.21.174.213:40420 > 167.82.56.223:https 
2026-01-26 06:23:29,277 | INFO | WIRESHARK | Ether / IP / TCP 172.21.174.213:40420 > 167.82.56.223:https A
2026-01-26 06:23:29,287 | INFO | WIRESHARK | Ether / IP / TCP 167.82.56.223:https > 172.21.174.213:40420 
2026-01-26 06:23:29,288 | INFO | WIRESHARK | Ether / IP / TCP 167.82.56.223:https > 172.21.174.213:40420 A / Raw
2026-01-26 06:23:29,299 | INFO | WIRESHARK | Ether / IP / TCP 167.82.56.223:https > 172.21.174.213:40420 A / Raw
2026-01-26 06:23:29,300 | INFO | WIRESHARK | Ether / IP / TCP 167.82.56.223:https > 172.21.174.213:40420 
2026-01-26 06:23:29,305 | INFO | WIRESHARK | Ether / IP / TCP 172.21.174.213:40420 > 167.82.56.223:https A
2026-01-26 06:23:29,307 | INFO | WIRESHARK | Ether / IP / TCP 172.21.174.213:40420 > 167.82.56.223:https 
2026-01-26 06:23:29,352 | INFO | WIRESHARK | Ether / IP / TCP 167.82.56.223:https > 172.21.174.213:40420 A / Raw
2026-01-26 06:23:29,354 | INFO | WIRESHARK | Ether / IP / TCP 167.82.56.223:https > 172.21.174.213:40420 
2026-01-26 06:23:29,374 | INFO | WIRESHARK | Ether / IP / TCP 167.82.56.223:https > 172.21.174.213:40420 
2026-01-26 06:23:29,379 | INFO | WIRESHARK | Ether / IP / TCP 172.21.174.213:40420 > 167.82.56.223:https 
2026-01-26 06:23:29,376 | INFO | WIRESHARK | Ether / IP / TCP 167.82.56.223:https > 172.21.174.213:40420 A / Raw
2026-01-26 06:23:29,385 | INFO | WIRESHARK | Ether / IP / TCP 172.21.174.213:40420 > 167.82.56.223:https A
2026-01-26 06:23:29,389 | INFO | WIRESHARK | Ether / IP / TCP 167.82.56.223:https > 172.21.174.213:40420 A / Raw
2026-01-26 06:23:29,390 | INFO | WIRESHARK | Ether / IP / TCP 167.82.56.223:https > 172.21.174.213:40420 
2026-01-26 06:23:29,445 | INFO | WIRESHARK | Ether / IP / TCP 172.21.174.213:40420 > 167.82.56.223:https 
2026-01-26 06:23:29,446 | INFO | WIRESHARK | Ether / IP / TCP 172.21.174.213:40420 > 167.82.56.223:https A
2026-01-26 06:23:29,450 | INFO | WIRESHARK | Ether / IP / TCP 167.82.56.223:https > 172.21.174.213:40420 
2026-01-26 06:23:29,453 | INFO | WIRESHARK | Ether / IP / TCP 167.82.56.223:https > 172.21.174.213:40420 A / Raw
2026-01-26 06:23:29,464 | INFO | WIRESHARK | Ether / IP / TCP 167.82.56.223:https > 172.21.174.213:40420 
2026-01-26 06:23:29,465 | INFO | WIRESHARK | Ether / IP / TCP 167.82.56.223:https > 172.21.174.213:40420 A / Raw
2026-01-26 06:23:29,468 | INFO | WIRESHARK | Ether / IP / TCP 172.21.174.213:40420 > 167.82.56.223:https 
2026-01-26 06:23:29,470 | INFO | WIRESHARK | Ether / IP / TCP 172.21.174.213:40420 > 167.82.56.223:https A
2026-01-26 06:23:29,523 | INFO | WIRESHARK | Ether / IP / TCP 167.82.56.223:https > 172.21.174.213:40420 PA / Raw
2026-01-26 06:23:29,524 | INFO | WIRESHARK | Ether / IP / TCP 167.82.56.223:https > 172.21.174.213:40420 
2026-01-26 06:23:29,528 | INFO | WIRESHARK | Ether / IP / TCP 172.21.174.213:40420 > 167.82.56.223:https A
2026-01-26 06:23:29,531 | INFO | WIRESHARK | Ether / IP / TCP 172.21.174.213:40420 > 167.82.56.223:https 
2026-01-26 06:23:29,540 | INFO | WIRESHARK | Ether / IP / TCP 167.82.56.223:https > 172.21.174.213:40420 A / Raw
2026-01-26 06:23:29,541 | INFO | WIRESHARK | Ether / IP / TCP 167.82.56.223:https > 172.21.174.213:40420 
2026-01-26 06:23:29,561 | INFO | WIRESHARK | Ether / IP / TCP 167.82.56.223:https > 172.21.174.213:40420 
2026-01-26 06:23:29,562 | INFO | WIRESHARK | Ether / IP / TCP 167.82.56.223:https > 172.21.174.213:40420 A / Raw
2026-01-26 06:23:29,566 | INFO | WIRESHARK | Ether / IP / TCP 172.21.174.213:40420 > 167.82.56.223:https 
2026-01-26 06:23:29,569 | INFO | WIRESHARK | Ether / IP / TCP 172.21.174.213:40420 > 167.82.56.223:https A
2026-01-26 06:23:29,599 | INFO | WIRESHARK | Ether / IP / TCP 167.82.56.223:https > 172.21.174.213:40420 
2026-01-26 06:23:29,600 | INFO | WIRESHARK | Ether / IP / TCP 167.82.56.223:https > 172.21.174.213:40420 PA / Raw
2026-01-26 06:23:29,604 | INFO | WIRESHARK | Ether / IP / TCP 172.21.174.213:40420 > 167.82.56.223:https 
2026-01-26 06:23:29,608 | INFO | WIRESHARK | Ether / IP / TCP 172.21.174.213:40420 > 167.82.56.223:https A
2026-01-26 06:23:29,662 | INFO | WIRESHARK | Ether / IP / TCP 167.82.56.223:https > 172.21.174.213:40420 
2026-01-26 06:23:29,666 | INFO | WIRESHARK | Ether / IP / TCP 172.21.174.213:40420 > 167.82.56.223:https 
2026-01-26 06:23:29,663 | INFO | WIRESHARK | Ether / IP / TCP 167.82.56.223:https > 172.21.174.213:40420 PA / Raw
2026-01-26 06:23:29,672 | INFO | WIRESHARK | Ether / IP / TCP 172.21.174.213:40420 > 167.82.56.223:https A
2026-01-26 06:23:29,702 | INFO | WIRESHARK | Ether / IP / TCP 167.82.56.223:https > 172.21.174.213:40420 
2026-01-26 06:23:29,708 | INFO | WIRESHARK | Ether / IP / TCP 172.21.174.213:40420 > 167.82.56.223:https 
2026-01-26 06:23:29,704 | INFO | WIRESHARK | Ether / IP / TCP 167.82.56.223:https > 172.21.174.213:40420 PA / Raw
2026-01-26 06:23:29,716 | INFO | WIRESHARK | Ether / IP / TCP 172.21.174.213:40420 > 167.82.56.223:https A
2026-01-26 06:23:29,759 | INFO | WIRESHARK | Ether / IP / TCP 167.82.56.223:https > 172.21.174.213:40420 
2026-01-26 06:23:29,760 | INFO | WIRESHARK | Ether / IP / TCP 167.82.56.223:https > 172.21.174.213:40420 PA / Raw
2026-01-26 06:23:29,763 | INFO | WIRESHARK | Ether / IP / TCP 172.21.174.213:40420 > 167.82.56.223:https 
2026-01-26 06:23:29,766 | INFO | WIRESHARK | Ether / IP / TCP 172.21.174.213:40420 > 167.82.56.223:https A
2026-01-26 06:23:29,792 | INFO | WIRESHARK | Ether / IP / TCP 167.82.56.223:https > 172.21.174.213:40420 
2026-01-26 06:23:29,793 | INFO | WIRESHARK | Ether / IP / TCP 167.82.56.223:https > 172.21.174.213:40420 PA / Raw
2026-01-26 06:23:29,796 | INFO | WIRESHARK | Ether / IP / TCP 172.21.174.213:40420 > 167.82.56.223:https 
2026-01-26 06:23:29,801 | INFO | WIRESHARK | Ether / IP / TCP 172.21.174.213:40420 > 167.82.56.223:https A
2026-01-26 06:23:29,806 | INFO | WIRESHARK | Ether / IP / TCP 167.82.56.223:https > 172.21.174.213:40420 
2026-01-26 06:23:29,808 | INFO | WIRESHARK | Ether / IP / TCP 167.82.56.223:https > 172.21.174.213:40420 A / Raw
2026-01-26 06:23:29,851 | INFO | WIRESHARK | Ether / IP / TCP 167.82.56.223:https > 172.21.174.213:40420 
2026-01-26 06:23:29,853 | INFO | WIRESHARK | Ether / IP / TCP 167.82.56.223:https > 172.21.174.213:40420 PA / Raw
2026-01-26 06:23:29,857 | INFO | WIRESHARK | Ether / IP / TCP 172.21.174.213:40420 > 167.82.56.223:https 
2026-01-26 06:23:29,861 | INFO | WIRESHARK | Ether / IP / TCP 172.21.174.213:40420 > 167.82.56.223:https A
2026-01-26 06:23:29,943 | INFO | WIRESHARK | Ether / IP / TCP 167.82.56.223:https > 172.21.174.213:40420 PA / Raw
2026-01-26 06:23:29,944 | INFO | WIRESHARK | Ether / IP / TCP 167.82.56.223:https > 172.21.174.213:40420 
2026-01-26 06:23:29,947 | INFO | WIRESHARK | Ether / IP / TCP 172.21.174.213:40420 > 167.82.56.223:https A
2026-01-26 06:23:29,951 | INFO | WIRESHARK | Ether / IP / TCP 172.21.174.213:40420 > 167.82.56.223:https 
2026-01-26 06:23:30,031 | INFO | WIRESHARK | Ether / IP / TCP 167.82.56.223:https > 172.21.174.213:40420 PA / Raw
2026-01-26 06:23:30,032 | INFO | WIRESHARK | Ether / IP / TCP 167.82.56.223:https > 172.21.174.213:40420 
2026-01-26 06:23:30,076 | INFO | METRIC | CPU: 1.8% | PKTS: 4177
2026-01-26 06:23:30,082 | INFO | WIRESHARK | Ether / IP / TCP 172.21.174.213:40420 > 167.82.56.223:https A
2026-01-26 06:23:30,084 | INFO | WIRESHARK | Ether / IP / TCP 172.21.174.213:40420 > 167.82.56.223:https 
2026-01-26 06:23:30,088 | INFO | WIRESHARK | Ether / IP / TCP 167.82.56.223:https > 172.21.174.213:40420 PA / Raw
2026-01-26 06:23:30,107 | INFO | WIRESHARK | Ether / IP / TCP 167.82.56.223:https > 172.21.174.213:40420 
2026-01-26 06:23:30,110 | INFO | WIRESHARK | Ether / IP / TCP 172.21.174.213:40420 > 167.82.56.223:https A
2026-01-26 06:23:30,112 | INFO | WIRESHARK | Ether / IP / TCP 172.21.174.213:40420 > 167.82.56.223:https 
2026-01-26 06:23:30,115 | INFO | WIRESHARK | Ether / IP / TCP 167.82.56.223:https > 172.21.174.213:40420 PA / Raw
2026-01-26 06:23:30,117 | INFO | WIRESHARK | Ether / IP / TCP 167.82.56.223:https > 172.21.174.213:40420 
2026-01-26 06:23:30,119 | INFO | WIRESHARK | Ether / IP / TCP 172.21.174.213:40420 > 167.82.56.223:https A
2026-01-26 06:23:30,121 | INFO | WIRESHARK | Ether / IP / TCP 172.21.174.213:40420 > 167.82.56.223:https 
2026-01-26 06:23:30,132 | INFO | WIRESHARK | Ether / IP / TCP 167.82.56.223:https > 172.21.174.213:40420 
2026-01-26 06:23:30,132 | INFO | WIRESHARK | Ether / IP / TCP 167.82.56.223:https > 172.21.174.213:40420 PA / Raw
2026-01-26 06:23:30,135 | INFO | WIRESHARK | Ether / IP / TCP 172.21.174.213:40420 > 167.82.56.223:https 
2026-01-26 06:23:30,136 | INFO | WIRESHARK | Ether / IP / TCP 172.21.174.213:40420 > 167.82.56.223:https A
2026-01-26 06:23:30,159 | INFO | WIRESHARK | Ether / IP / TCP 167.82.56.223:https > 172.21.174.213:40420 A / Raw
2026-01-26 06:23:30,160 | INFO | WIRESHARK | Ether / IP / TCP 167.82.56.223:https > 172.21.174.213:40420 
2026-01-26 06:23:30,190 | INFO | WIRESHARK | Ether / IP / TCP 167.82.56.223:https > 172.21.174.213:40420 PA / Raw
2026-01-26 06:23:30,191 | INFO | WIRESHARK | Ether / IP / TCP 167.82.56.223:https > 172.21.174.213:40420 
2026-01-26 06:23:30,195 | INFO | WIRESHARK | Ether / IP / TCP 172.21.174.213:40420 > 167.82.56.223:https A
2026-01-26 06:23:30,198 | INFO | WIRESHARK | Ether / IP / TCP 172.21.174.213:40420 > 167.82.56.223:https 
2026-01-26 06:23:30,209 | INFO | WIRESHARK | Ether / IP / TCP 167.82.56.223:https > 172.21.174.213:40420 PA / Raw
2026-01-26 06:23:30,211 | INFO | WIRESHARK | Ether / IP / TCP 167.82.56.223:https > 172.21.174.213:40420 
2026-01-26 06:23:30,214 | INFO | WIRESHARK | Ether / IP / TCP 172.21.174.213:40420 > 167.82.56.223:https A
2026-01-26 06:23:30,218 | INFO | WIRESHARK | Ether / IP / TCP 172.21.174.213:40420 > 167.82.56.223:https 
2026-01-26 06:23:30,285 | INFO | WIRESHARK | Ether / IP / TCP 167.82.56.223:https > 172.21.174.213:40420 PA / Raw
2026-01-26 06:23:30,287 | INFO | WIRESHARK | Ether / IP / TCP 167.82.56.223:https > 172.21.174.213:40420 
2026-01-26 06:23:30,291 | INFO | WIRESHARK | Ether / IP / TCP 172.21.174.213:40420 > 167.82.56.223:https A
2026-01-26 06:23:30,294 | INFO | WIRESHARK | Ether / IP / TCP 172.21.174.213:40420 > 167.82.56.223:https 
2026-01-26 06:23:30,313 | INFO | WIRESHARK | Ether / IP / TCP 167.82.56.223:https > 172.21.174.213:40420 A / Raw
2026-01-26 06:23:30,314 | INFO | WIRESHARK | Ether / IP / TCP 167.82.56.223:https > 172.21.174.213:40420 
2026-01-26 06:23:30,319 | INFO | WIRESHARK | Ether / IP / TCP 172.21.174.213:40420 > 167.82.56.223:https A
2026-01-26 06:23:30,324 | INFO | WIRESHARK | Ether / IP / TCP 172.21.174.213:40420 > 167.82.56.223:https 
2026-01-26 06:23:30,361 | INFO | WIRESHARK | Ether / IP / TCP 167.82.56.223:https > 172.21.174.213:40420 PA / Raw
2026-01-26 06:23:30,363 | INFO | WIRESHARK | Ether / IP / TCP 167.82.56.223:https > 172.21.174.213:40420 
2026-01-26 06:23:30,366 | INFO | WIRESHARK | Ether / IP / TCP 172.21.174.213:40420 > 167.82.56.223:https A
2026-01-26 06:23:30,371 | INFO | WIRESHARK | Ether / IP / TCP 172.21.174.213:40420 > 167.82.56.223:https 
2026-01-26 06:23:30,387 | INFO | WIRESHARK | Ether / IP / TCP 167.82.56.223:https > 172.21.174.213:40420 A / Raw
2026-01-26 06:23:30,389 | INFO | WIRESHARK | Ether / IP / TCP 167.82.56.223:https > 172.21.174.213:40420 
2026-01-26 06:23:30,436 | INFO | WIRESHARK | Ether / IP / TCP 172.21.174.213:40420 > 167.82.56.223:https A
2026-01-26 06:23:30,437 | INFO | WIRESHARK | Ether / IP / TCP 172.21.174.213:40420 > 167.82.56.223:https 
2026-01-26 06:23:30,445 | INFO | WIRESHARK | Ether / IP / TCP 167.82.56.223:https > 172.21.174.213:40420 
2026-01-26 06:23:30,448 | INFO | WIRESHARK | Ether / IP / TCP 167.82.56.223:https > 172.21.174.213:40420 
2026-01-26 06:23:30,441 | INFO | WIRESHARK | Ether / IP / TCP 167.82.56.223:https > 172.21.174.213:40420 A / Raw
2026-01-26 06:23:30,452 | INFO | WIRESHARK | Ether / IP / TCP 172.21.174.213:40420 > 167.82.56.223:https 
2026-01-26 06:23:30,459 | INFO | WIRESHARK | Ether / IP / TCP 167.82.56.223:https > 172.21.174.213:40420 A / Raw
2026-01-26 06:23:30,465 | INFO | WIRESHARK | Ether / IP / TCP 172.21.174.213:40420 > 167.82.56.223:https A
2026-01-26 06:23:30,513 | INFO | WIRESHARK | Ether / IP / TCP 167.82.56.223:https > 172.21.174.213:40420 
2026-01-26 06:23:30,515 | INFO | WIRESHARK | Ether / IP / TCP 167.82.56.223:https > 172.21.174.213:40420 PA / Raw
2026-01-26 06:23:30,517 | INFO | WIRESHARK | Ether / IP / TCP 172.21.174.213:40420 > 167.82.56.223:https 
2026-01-26 06:23:30,522 | INFO | WIRESHARK | Ether / IP / TCP 172.21.174.213:40420 > 167.82.56.223:https A
2026-01-26 06:23:30,531 | INFO | WIRESHARK | Ether / IP / TCP 167.82.56.223:https > 172.21.174.213:40420 PA / Raw
2026-01-26 06:23:30,532 | INFO | WIRESHARK | Ether / IP / TCP 167.82.56.223:https > 172.21.174.213:40420 
2026-01-26 06:23:30,535 | INFO | WIRESHARK | Ether / IP / TCP 172.21.174.213:40420 > 167.82.56.223:https A
2026-01-26 06:23:30,539 | INFO | WIRESHARK | Ether / IP / TCP 172.21.174.213:40420 > 167.82.56.223:https 
2026-01-26 06:23:30,589 | INFO | WIRESHARK | Ether / IP / TCP 167.82.56.223:https > 172.21.174.213:40420 
2026-01-26 06:23:30,590 | INFO | WIRESHARK | Ether / IP / TCP 167.82.56.223:https > 172.21.174.213:40420 PA / Raw
2026-01-26 06:23:30,597 | INFO | WIRESHARK | Ether / IP / TCP 172.21.174.213:40420 > 167.82.56.223:https 
2026-01-26 06:23:30,606 | INFO | WIRESHARK | Ether / IP / TCP 172.21.174.213:40420 > 167.82.56.223:https A
2026-01-26 06:23:30,624 | INFO | WIRESHARK | Ether / IP / TCP 167.82.56.223:https > 172.21.174.213:40420 PA / Raw
2026-01-26 06:23:30,625 | INFO | WIRESHARK | Ether / IP / TCP 167.82.56.223:https > 172.21.174.213:40420 
2026-01-26 06:23:30,629 | INFO | WIRESHARK | Ether / IP / TCP 172.21.174.213:40420 > 167.82.56.223:https A
2026-01-26 06:23:30,633 | INFO | WIRESHARK | Ether / IP / TCP 172.21.174.213:40420 > 167.82.56.223:https 
2026-01-26 06:23:30,689 | INFO | WIRESHARK | Ether / IP / TCP 167.82.56.223:https > 172.21.174.213:40420 PA / Raw
2026-01-26 06:23:30,690 | INFO | WIRESHARK | Ether / IP / TCP 167.82.56.223:https > 172.21.174.213:40420 
2026-01-26 06:23:30,697 | INFO | WIRESHARK | Ether / IP / TCP 172.21.174.213:40420 > 167.82.56.223:https 
2026-01-26 06:23:30,693 | INFO | WIRESHARK | Ether / IP / TCP 172.21.174.213:40420 > 167.82.56.223:https A
2026-01-26 06:23:30,719 | INFO | WIRESHARK | Ether / IP / TCP 167.82.56.223:https > 172.21.174.213:40420 PA / Raw
2026-01-26 06:23:30,720 | INFO | WIRESHARK | Ether / IP / TCP 167.82.56.223:https > 172.21.174.213:40420 
2026-01-26 06:23:30,723 | INFO | WIRESHARK | Ether / IP / TCP 172.21.174.213:40420 > 167.82.56.223:https A
2026-01-26 06:23:30,726 | INFO | WIRESHARK | Ether / IP / TCP 172.21.174.213:40420 > 167.82.56.223:https 
2026-01-26 06:23:30,782 | INFO | WIRESHARK | Ether / IP / TCP 167.82.56.223:https > 172.21.174.213:40420 PA / Raw
2026-01-26 06:23:30,783 | INFO | WIRESHARK | Ether / IP / TCP 167.82.56.223:https > 172.21.174.213:40420 
2026-01-26 06:23:30,787 | INFO | WIRESHARK | Ether / IP / TCP 172.21.174.213:40420 > 167.82.56.223:https A
2026-01-26 06:23:30,789 | INFO | WIRESHARK | Ether / IP / TCP 172.21.174.213:40420 > 167.82.56.223:https 
2026-01-26 06:23:30,805 | INFO | WIRESHARK | Ether / IP / TCP 167.82.56.223:https > 172.21.174.213:40420 PA / Raw
2026-01-26 06:23:30,806 | INFO | WIRESHARK | Ether / IP / TCP 167.82.56.223:https > 172.21.174.213:40420 
2026-01-26 06:23:30,807 | INFO | WIRESHARK | Ether / IP / TCP 172.21.174.213:40420 > 167.82.56.223:https A
2026-01-26 06:23:30,809 | INFO | WIRESHARK | Ether / IP / TCP 172.21.174.213:40420 > 167.82.56.223:https 
2026-01-26 06:23:30,813 | INFO | WIRESHARK | Ether / IP / TCP 167.82.56.223:https > 172.21.174.213:40420 A / Raw
2026-01-26 06:23:30,814 | INFO | WIRESHARK | Ether / IP / TCP 167.82.56.223:https > 172.21.174.213:40420 
2026-01-26 06:23:30,870 | INFO | WIRESHARK | Ether / IP / TCP 167.82.56.223:https > 172.21.174.213:40420 
2026-01-26 06:23:30,872 | INFO | WIRESHARK | Ether / IP / TCP 167.82.56.223:https > 172.21.174.213:40420 PA / Raw
2026-01-26 06:23:30,876 | INFO | WIRESHARK | Ether / IP / TCP 172.21.174.213:40420 > 167.82.56.223:https 
2026-01-26 06:23:30,880 | INFO | WIRESHARK | Ether / IP / TCP 172.21.174.213:40420 > 167.82.56.223:https A
2026-01-26 06:23:30,896 | INFO | WIRESHARK | Ether / IP / TCP 167.82.56.223:https > 172.21.174.213:40420 PA / Raw
2026-01-26 06:23:30,898 | INFO | WIRESHARK | Ether / IP / TCP 167.82.56.223:https > 172.21.174.213:40420 
2026-01-26 06:23:30,901 | INFO | WIRESHARK | Ether / IP / TCP 172.21.174.213:40420 > 167.82.56.223:https A
2026-01-26 06:23:30,905 | INFO | WIRESHARK | Ether / IP / TCP 172.21.174.213:40420 > 167.82.56.223:https 
2026-01-26 06:23:30,954 | INFO | WIRESHARK | Ether / IP / TCP 167.82.56.223:https > 172.21.174.213:40420 
2026-01-26 06:23:30,955 | INFO | WIRESHARK | Ether / IP / TCP 167.82.56.223:https > 172.21.174.213:40420 PA / Raw
2026-01-26 06:23:30,958 | INFO | WIRESHARK | Ether / IP / TCP 172.21.174.213:40420 > 167.82.56.223:https 
2026-01-26 06:23:30,963 | INFO | WIRESHARK | Ether / IP / TCP 172.21.174.213:40420 > 167.82.56.223:https A
2026-01-26 06:23:32,088 | INFO | METRIC | CPU: 5.0% | PKTS: 4223
2026-01-26 06:23:33,498 | INFO | WIRESHARK | Ether / IP / TCP 172.21.174.213:54862 > 151.101.0.223:https S
2026-01-26 06:23:33,499 | INFO | WIRESHARK | Ether / IP / TCP 172.21.174.213:54862 > 151.101.0.223:https 
2026-01-26 06:23:33,563 | INFO | WIRESHARK | Ether / IP / TCP 151.101.0.223:https > 172.21.174.213:54862 SA
2026-01-26 06:23:33,564 | INFO | WIRESHARK | Ether / IP / TCP 151.101.0.223:https > 172.21.174.213:54862 
2026-01-26 06:23:33,580 | INFO | WIRESHARK | Ether / IP / TCP 172.21.174.213:54862 > 151.101.0.223:https 
2026-01-26 06:23:33,577 | INFO | WIRESHARK | Ether / IP / TCP 172.21.174.213:54862 > 151.101.0.223:https A
2026-01-26 06:23:33,583 | INFO | WIRESHARK | Ether / IP / TCP 172.21.174.213:54862 > 151.101.0.223:https 
2026-01-26 06:23:33,586 | INFO | WIRESHARK | Ether / IP / TCP 172.21.174.213:54862 > 151.101.0.223:https PA / Raw
2026-01-26 06:23:33,641 | INFO | WIRESHARK | Ether / IP / TCP 151.101.0.223:https > 172.21.174.213:54862 
2026-01-26 06:23:33,642 | INFO | WIRESHARK | Ether / IP / TCP 151.101.0.223:https > 172.21.174.213:54862 A
2026-01-26 06:23:33,645 | INFO | WIRESHARK | Ether / IP / TCP 151.101.0.223:https > 172.21.174.213:54862 
2026-01-26 06:23:33,649 | INFO | WIRESHARK | Ether / IP / TCP 151.101.0.223:https > 172.21.174.213:54862 PA / Raw
2026-01-26 06:23:33,653 | INFO | WIRESHARK | Ether / IP / TCP 151.101.0.223:https > 172.21.174.213:54862 
2026-01-26 06:23:33,657 | INFO | WIRESHARK | Ether / IP / TCP 151.101.0.223:https > 172.21.174.213:54862 PA / Raw
2026-01-26 06:23:33,662 | INFO | WIRESHARK | Ether / IP / TCP 172.21.174.213:54862 > 151.101.0.223:https 
2026-01-26 06:23:33,665 | INFO | WIRESHARK | Ether / IP / TCP 172.21.174.213:54862 > 151.101.0.223:https A
2026-01-26 06:23:33,668 | INFO | WIRESHARK | Ether / IP / TCP 172.21.174.213:54862 > 151.101.0.223:https 
2026-01-26 06:23:33,671 | INFO | WIRESHARK | Ether / IP / TCP 172.21.174.213:54862 > 151.101.0.223:https A
2026-01-26 06:23:33,674 | INFO | WIRESHARK | Ether / IP / TCP 172.21.174.213:54862 > 151.101.0.223:https 
2026-01-26 06:23:33,678 | INFO | WIRESHARK | Ether / IP / TCP 172.21.174.213:54862 > 151.101.0.223:https PA / Raw
2026-01-26 06:23:33,680 | INFO | WIRESHARK | Ether / IP / TCP 172.21.174.213:54862 > 151.101.0.223:https 
2026-01-26 06:23:33,682 | INFO | WIRESHARK | Ether / IP / TCP 172.21.174.213:54862 > 151.101.0.223:https PA / Raw
2026-01-26 06:23:33,709 | INFO | WIRESHARK | Ether / IP / TCP 151.101.0.223:https > 172.21.174.213:54862 A
2026-01-26 06:23:33,710 | INFO | WIRESHARK | Ether / IP / TCP 151.101.0.223:https > 172.21.174.213:54862 
2026-01-26 06:23:33,713 | INFO | WIRESHARK | Ether / IP / TCP 151.101.0.223:https > 172.21.174.213:54862 A
2026-01-26 06:23:33,716 | INFO | WIRESHARK | Ether / IP / TCP 151.101.0.223:https > 172.21.174.213:54862 
2026-01-26 06:23:33,719 | INFO | WIRESHARK | Ether / IP / TCP 151.101.0.223:https > 172.21.174.213:54862 PA / Raw
2026-01-26 06:23:33,723 | INFO | WIRESHARK | Ether / IP / TCP 151.101.0.223:https > 172.21.174.213:54862 
2026-01-26 06:23:33,726 | INFO | WIRESHARK | Ether / IP / TCP 151.101.0.223:https > 172.21.174.213:54862 PA / Raw
2026-01-26 06:23:33,730 | INFO | WIRESHARK | Ether / IP / TCP 151.101.0.223:https > 172.21.174.213:54862 
2026-01-26 06:23:33,733 | INFO | WIRESHARK | Ether / IP / TCP 172.21.174.213:54862 > 151.101.0.223:https A
2026-01-26 06:23:33,736 | INFO | WIRESHARK | Ether / IP / TCP 172.21.174.213:54862 > 151.101.0.223:https 
2026-01-26 06:23:33,738 | INFO | WIRESHARK | Ether / IP / TCP 172.21.174.213:54862 > 151.101.0.223:https A
2026-01-26 06:23:33,741 | INFO | WIRESHARK | Ether / IP / TCP 172.21.174.213:54862 > 151.101.0.223:https 
2026-01-26 06:23:33,743 | INFO | WIRESHARK | Ether / IP / TCP 151.101.0.223:https > 172.21.174.213:54862 PA / Raw
2026-01-26 06:23:33,745 | INFO | WIRESHARK | Ether / IP / TCP 151.101.0.223:https > 172.21.174.213:54862 
2026-01-26 06:23:33,747 | INFO | WIRESHARK | Ether / IP / TCP 172.21.174.213:54862 > 151.101.0.223:https A
2026-01-26 06:23:33,750 | INFO | WIRESHARK | Ether / IP / TCP 172.21.174.213:54862 > 151.101.0.223:https 
2026-01-26 06:23:33,752 | INFO | WIRESHARK | Ether / IP / TCP 151.101.0.223:https > 172.21.174.213:54862 PA / Raw
2026-01-26 06:23:33,753 | INFO | WIRESHARK | Ether / IP / TCP 151.101.0.223:https > 172.21.174.213:54862 
2026-01-26 06:23:33,756 | INFO | WIRESHARK | Ether / IP / TCP 172.21.174.213:54862 > 151.101.0.223:https A
2026-01-26 06:23:33,758 | INFO | WIRESHARK | Ether / IP / TCP 172.21.174.213:54862 > 151.101.0.223:https 
2026-01-26 06:23:33,760 | INFO | WIRESHARK | Ether / IP / TCP 151.101.0.223:https > 172.21.174.213:54862 PA / Raw
2026-01-26 06:23:33,763 | INFO | WIRESHARK | Ether / IP / TCP 151.101.0.223:https > 172.21.174.213:54862 
2026-01-26 06:23:33,765 | INFO | WIRESHARK | Ether / IP / TCP 172.21.174.213:54862 > 151.101.0.223:https A
2026-01-26 06:23:33,767 | INFO | WIRESHARK | Ether / IP / TCP 172.21.174.213:54862 > 151.101.0.223:https 
2026-01-26 06:23:33,770 | INFO | WIRESHARK | Ether / IP / TCP 151.101.0.223:https > 172.21.174.213:54862 PA / Raw
2026-01-26 06:23:33,772 | INFO | WIRESHARK | Ether / IP / TCP 151.101.0.223:https > 172.21.174.213:54862 
2026-01-26 06:23:33,774 | INFO | WIRESHARK | Ether / IP / TCP 172.21.174.213:54862 > 151.101.0.223:https A
2026-01-26 06:23:33,775 | INFO | WIRESHARK | Ether / IP / TCP 172.21.174.213:54862 > 151.101.0.223:https 
2026-01-26 06:23:33,778 | INFO | WIRESHARK | Ether / IP / TCP 151.101.0.223:https > 172.21.174.213:54862 PA / Raw
2026-01-26 06:23:33,780 | INFO | WIRESHARK | Ether / IP / TCP 151.101.0.223:https > 172.21.174.213:54862 
2026-01-26 06:23:33,783 | INFO | WIRESHARK | Ether / IP / TCP 172.21.174.213:54862 > 151.101.0.223:https A
2026-01-26 06:23:33,785 | INFO | WIRESHARK | Ether / IP / TCP 172.21.174.213:54862 > 151.101.0.223:https 
2026-01-26 06:23:33,788 | INFO | WIRESHARK | Ether / IP / TCP 151.101.0.223:https > 172.21.174.213:54862 PA / Raw
2026-01-26 06:23:33,790 | INFO | WIRESHARK | Ether / IP / TCP 151.101.0.223:https > 172.21.174.213:54862 
2026-01-26 06:23:33,793 | INFO | WIRESHARK | Ether / IP / TCP 172.21.174.213:54862 > 151.101.0.223:https A
2026-01-26 06:23:33,795 | INFO | WIRESHARK | Ether / IP / TCP 172.21.174.213:54862 > 151.101.0.223:https 
2026-01-26 06:23:33,797 | INFO | WIRESHARK | Ether / IP / TCP 151.101.0.223:https > 172.21.174.213:54862 A / Raw
2026-01-26 06:23:33,799 | INFO | WIRESHARK | Ether / IP / TCP 151.101.0.223:https > 172.21.174.213:54862 
2026-01-26 06:23:33,801 | INFO | WIRESHARK | Ether / IP / TCP 151.101.0.223:https > 172.21.174.213:54862 PA / Raw
2026-01-26 06:23:33,803 | INFO | WIRESHARK | Ether / IP / TCP 151.101.0.223:https > 172.21.174.213:54862 
2026-01-26 06:23:33,806 | INFO | WIRESHARK | Ether / IP / TCP 172.21.174.213:54862 > 151.101.0.223:https A
2026-01-26 06:23:33,807 | INFO | WIRESHARK | Ether / IP / TCP 172.21.174.213:54862 > 151.101.0.223:https 
2026-01-26 06:23:33,809 | INFO | WIRESHARK | Ether / IP / TCP 151.101.0.223:https > 172.21.174.213:54862 PA / Raw
2026-01-26 06:23:33,811 | INFO | WIRESHARK | Ether / IP / TCP 151.101.0.223:https > 172.21.174.213:54862 
2026-01-26 06:23:33,813 | INFO | WIRESHARK | Ether / IP / TCP 172.21.174.213:54862 > 151.101.0.223:https A
2026-01-26 06:23:33,815 | INFO | WIRESHARK | Ether / IP / TCP 172.21.174.213:54862 > 151.101.0.223:https 
2026-01-26 06:23:33,818 | INFO | WIRESHARK | Ether / IP / TCP 151.101.0.223:https > 172.21.174.213:54862 PA / Raw
2026-01-26 06:23:33,820 | INFO | WIRESHARK | Ether / IP / TCP 151.101.0.223:https > 172.21.174.213:54862 
2026-01-26 06:23:33,822 | INFO | WIRESHARK | Ether / IP / TCP 172.21.174.213:54862 > 151.101.0.223:https A
2026-01-26 06:23:33,825 | INFO | WIRESHARK | Ether / IP / TCP 172.21.174.213:54862 > 151.101.0.223:https 
2026-01-26 06:23:33,826 | INFO | WIRESHARK | Ether / IP / TCP 151.101.0.223:https > 172.21.174.213:54862 PA / Raw
2026-01-26 06:23:33,829 | INFO | WIRESHARK | Ether / IP / TCP 151.101.0.223:https > 172.21.174.213:54862 
2026-01-26 06:23:33,830 | INFO | WIRESHARK | Ether / IP / TCP 172.21.174.213:54862 > 151.101.0.223:https A
2026-01-26 06:23:33,832 | INFO | WIRESHARK | Ether / IP / TCP 172.21.174.213:54862 > 151.101.0.223:https 
2026-01-26 06:23:33,834 | INFO | WIRESHARK | Ether / IP / TCP 151.101.0.223:https > 172.21.174.213:54862 A / Raw
2026-01-26 06:23:33,836 | INFO | WIRESHARK | Ether / IP / TCP 151.101.0.223:https > 172.21.174.213:54862 
2026-01-26 06:23:33,837 | INFO | WIRESHARK | Ether / IP / TCP 172.21.174.213:54862 > 151.101.0.223:https A
2026-01-26 06:23:33,840 | INFO | WIRESHARK | Ether / IP / TCP 172.21.174.213:54862 > 151.101.0.223:https 
2026-01-26 06:23:33,843 | INFO | WIRESHARK | Ether / IP / TCP 151.101.0.223:https > 172.21.174.213:54862 A / Raw
2026-01-26 06:23:33,845 | INFO | WIRESHARK | Ether / IP / TCP 151.101.0.223:https > 172.21.174.213:54862 
2026-01-26 06:23:33,847 | INFO | WIRESHARK | Ether / IP / TCP 172.21.174.213:54862 > 151.101.0.223:https A
2026-01-26 06:23:33,848 | INFO | WIRESHARK | Ether / IP / TCP 172.21.174.213:54862 > 151.101.0.223:https 
2026-01-26 06:23:33,885 | INFO | WIRESHARK | Ether / IP / TCP 172.21.174.213:54862 > 151.101.0.223:https FA
2026-01-26 06:23:33,886 | INFO | WIRESHARK | Ether / IP / TCP 172.21.174.213:54862 > 151.101.0.223:https 
2026-01-26 06:23:33,888 | INFO | WIRESHARK | Ether / IP / TCP 172.21.174.213:41220 > 151.101.0.223:https FA
2026-01-26 06:23:33,890 | INFO | WIRESHARK | Ether / IP / TCP 172.21.174.213:41220 > 151.101.0.223:https 
2026-01-26 06:23:33,891 | INFO | WIRESHARK | Ether / IP / TCP 172.21.174.213:40420 > 167.82.56.223:https FA
2026-01-26 06:23:33,893 | INFO | WIRESHARK | Ether / IP / TCP 172.21.174.213:40420 > 167.82.56.223:https 
2026-01-26 06:23:33,951 | INFO | WIRESHARK | Ether / IP / TCP 151.101.0.223:https > 172.21.174.213:54862 
2026-01-26 06:23:33,952 | INFO | WIRESHARK | Ether / IP / TCP 151.101.0.223:https > 172.21.174.213:54862 A
2026-01-26 06:23:33,955 | INFO | WIRESHARK | Ether / IP / TCP 151.101.0.223:https > 172.21.174.213:54862 
2026-01-26 06:23:33,957 | INFO | WIRESHARK | Ether / IP / TCP 151.101.0.223:https > 172.21.174.213:54862 PA / Raw
2026-01-26 06:23:33,959 | INFO | WIRESHARK | Ether / IP / TCP 151.101.0.223:https > 172.21.174.213:54862 
2026-01-26 06:23:33,961 | INFO | WIRESHARK | Ether / IP / TCP 151.101.0.223:https > 172.21.174.213:54862 FA
2026-01-26 06:23:33,962 | INFO | WIRESHARK | Ether / IP / TCP 151.101.0.223:https > 172.21.174.213:41220 
2026-01-26 06:23:33,965 | INFO | WIRESHARK | Ether / IP / TCP 151.101.0.223:https > 172.21.174.213:41220 A
2026-01-26 06:23:33,967 | INFO | WIRESHARK | Ether / IP / TCP 172.21.174.213:54862 > 151.101.0.223:https 
2026-01-26 06:23:33,968 | INFO | WIRESHARK | Ether / IP / TCP 172.21.174.213:54862 > 151.101.0.223:https R
2026-01-26 06:23:33,970 | INFO | WIRESHARK | Ether / IP / TCP 172.21.174.213:54862 > 151.101.0.223:https 
2026-01-26 06:23:33,972 | INFO | WIRESHARK | Ether / IP / TCP 172.21.174.213:54862 > 151.101.0.223:https R
2026-01-26 06:23:33,974 | INFO | WIRESHARK | Ether / IP / TCP 151.101.0.223:https > 172.21.174.213:41220 
2026-01-26 06:23:33,977 | INFO | WIRESHARK | Ether / IP / TCP 151.101.0.223:https > 172.21.174.213:41220 PA / Raw
2026-01-26 06:23:33,979 | INFO | WIRESHARK | Ether / IP / TCP 151.101.0.223:https > 172.21.174.213:41220 
2026-01-26 06:23:33,980 | INFO | WIRESHARK | Ether / IP / TCP 151.101.0.223:https > 172.21.174.213:41220 FA
2026-01-26 06:23:33,983 | INFO | WIRESHARK | Ether / IP / TCP 172.21.174.213:41220 > 151.101.0.223:https 
2026-01-26 06:23:33,985 | INFO | WIRESHARK | Ether / IP / TCP 172.21.174.213:41220 > 151.101.0.223:https R
2026-01-26 06:23:33,987 | INFO | WIRESHARK | Ether / IP / TCP 172.21.174.213:41220 > 151.101.0.223:https 
2026-01-26 06:23:33,989 | INFO | WIRESHARK | Ether / IP / TCP 172.21.174.213:41220 > 151.101.0.223:https R
2026-01-26 06:23:33,991 | INFO | WIRESHARK | Ether / IP / TCP 167.82.56.223:https > 172.21.174.213:40420 
2026-01-26 06:23:33,994 | INFO | WIRESHARK | Ether / IP / TCP 167.82.56.223:https > 172.21.174.213:40420 A
2026-01-26 06:23:33,995 | INFO | WIRESHARK | Ether / IP / TCP 167.82.56.223:https > 172.21.174.213:40420 
2026-01-26 06:23:33,997 | INFO | WIRESHARK | Ether / IP / TCP 167.82.56.223:https > 172.21.174.213:40420 PA / Raw
2026-01-26 06:23:33,999 | INFO | WIRESHARK | Ether / IP / TCP 167.82.56.223:https > 172.21.174.213:40420 
2026-01-26 06:23:34,001 | INFO | WIRESHARK | Ether / IP / TCP 167.82.56.223:https > 172.21.174.213:40420 FA
2026-01-26 06:23:34,003 | INFO | WIRESHARK | Ether / IP / TCP 172.21.174.213:40420 > 167.82.56.223:https 
2026-01-26 06:23:34,005 | INFO | WIRESHARK | Ether / IP / TCP 172.21.174.213:40420 > 167.82.56.223:https R
2026-01-26 06:23:34,008 | INFO | WIRESHARK | Ether / IP / TCP 172.21.174.213:40420 > 167.82.56.223:https 
2026-01-26 06:23:34,010 | INFO | WIRESHARK | Ether / IP / TCP 172.21.174.213:40420 > 167.82.56.223:https R
2026-01-26 06:23:34,093 | INFO | METRIC | CPU: 5.0% | PKTS: 4283
2026-01-26 06:23:36,098 | INFO | METRIC | CPU: 4.6% | PKTS: 4283
