2026-01-26 06:23:25,443 | INFO | WIRESHARK | Ether / IP / TCP 172.21.174.213:40420 > 167.82.56.223:https A
2026-01-26 06:23:25,520 | INFO | WIRESHARK | Ether / IP / TCP 167.82.56.223:https > 172.21.174.213:40420 A / Raw
2026-01-26 06:23:25,521 | INFO | WIRESHARK | Ether / IP / TCP 167.82.56.223:https > 172.21.174.213:40420 
2026-01-26 06:23:25,525 | INFO | WIRESHARK | Ether / IP / TCP 167.82.56.223:https > 172.21.174.213:40420 A / Raw
2026-01-26 06:23:25,529 | INFO | WIRESHARK | Ether / IP / TCP 167.82.56.223:https > 172.21.174.213:40420 
2026-01-26 06:23:25,532 | INFO | WIRESHARK | Ether / IP / TCP 172.21.174.213:40420 > 167.82.56.223:https A
2026-01-26 06:23:25,536 | INFO | WIRESHARK | Ether / IP / TCP 172.21.174.213:40420 > 167.82.56.223:https 
2026-01-26 06:23:25,540 | INFO | WIRESHARK | Ether / IP / TCP 172.21.174.213:40420 > 167.82.56.223:https A
2026-01-26 06:23:25,544 | INFO | WIRESHARK | Ether / IP / TCP 172.21.174.213:40420 > 167.82.56.223:https 
2026-01-26 06:23:25,600 | INFO | WIRESHARK | Ether / IP / TCP 167.82.56.223:https > 172.21.174.213:40420 A / Raw
2026-01-26 06:23:25,601 | INFO | WIRESHARK | Ether / IP / TCP 167.82.56.223:https > 172.21.174.213:40420 
2026-01-26 06:23:25,606 | INFO | WIRESHARK | Ether / IP / TCP 172.21.174.213:40420 > 167.82.56.223:https A
2026-01-26 06:23:25,609 | INFO | WIRESHARK | Ether / IP / TCP 172.21.174.213:40420 > 167.82.56.223:https 
2026-01-26 06:23:25,612 | INFO | WIRESHARK | Ether / IP / TCP 167.82.56.223:https > 172.21.174.213:40420 A / Raw
2026-01-26 06:23:25,616 | INFO | WIRESHARK | Ether / IP / TCP 167.82.56.223:https > 172.21.174.213:40420 
2026-01-26 06:23:25,652 | INFO | WIRESHARK | Ether / IP / TCP 172.21.174.213:40420 > 167.82.56.223:https 
2026-01-26 06:23:25,654 | INFO | WIRESHARK | Ether / IP / TCP 172.21.174.213:40420 > 167.82.56.223:https A
2026-01-26 06:23:25,683 | INFO | WIRESHARK | Ether / IP / TCP 167.82.56.223:https > 172.21.174.213:40420 A / Raw
2026-01-26 06:23:25,684 | INFO | WIRESHARK | Ether / IP / TCP 167.82.56.223:https > 172.21.174.213:40420 
2026-01-26 06:23:25,693 | INFO | WIRESHARK | Ether / IP / TCP 167.82.56.223:https > 172.21.174.213:40420 A / Raw
2026-01-26 06:23:25,694 | INFO | WIRESHARK | Ether / IP / TCP 167.82.56.223:https > 172.21.174.213:40420 
2026-01-26 06:23:25,697 | INFO | WIRESHARK | Ether / IP / TCP 172.21.174.213:40420 > 167.82.56.223:https A
2026-01-26 06:23:25,701 | INFO | WIRESHARK | Ether / IP / TCP 172.21.174.213:40420 > 167.82.56.223:https 
2026-01-26 06:23:25,729 | INFO | WIRESHARK | Ether / IP / TCP 167.82.56.223:https > 172.21.174.213:40420 A / Raw
2026-01-26 06:23:25,731 | INFO | WIRESHARK | Ether / IP / TCP 167.82.56.223:https > 172.21.174.213:40420 
2026-01-26 06:23:25,770 | INFO | WIRESHARK | Ether / IP / TCP 167.82.56.223:https > 172.21.174.213:40420 A / Raw
2026-01-26 06:23:25,772 | INFO | WIRESHARK | Ether / IP / TCP 167.82.56.223:https > 172.21.174.213:40420 
2026-01-26 06:23:25,775 | INFO | WIRESHARK | Ether / IP / TCP 172.21.174.213:40420 > 167.82.56.223:https A
2026-01-26 06:23:25,779 | INFO | WIRESHARK | Ether / IP / TCP 172.21.174.213:40420 > 167.82.56.223:https 
2026-01-26 06:23:25,786 | INFO | WIRESHARK | Ether / IP / TCP 167.82.56.223:https > 172.21.174.213:40420 A / Raw
2026-01-26 06:23:25,787 | INFO | WIRESHARK | Ether / IP / TCP 167.82.56.223:https > 172.21.174.213:40420 
2026-01-26 06:23:25,790 | INFO | WIRESHARK | Ether / IP / TCP 172.21.174.213:40420 > 167.82.56.223:https A
2026-01-26 06:23:25,793 | INFO | WIRESHARK | Ether / IP / TCP 172.21.174.213:40420 > 167.82.56.223:https 
2026-01-26 06:23:25,845 | INFO | WIRESHARK | Ether / IP / TCP 167.82.56.223:https > 172.21.174.213:40420 A / Raw
2026-01-26 06:23:25,846 | INFO | WIRESHARK | Ether / IP / TCP 167.82.56.223:https > 172.21.174.213:40420 
2026-01-26 06:23:25,849 | INFO | WIRESHARK | Ether / IP / TCP 172.21.174.213:40420 > 167.82.56.223:https A
2026-01-26 06:23:25,852 | INFO | WIRESHARK | Ether / IP / TCP 172.21.174.213:40420 > 167.82.56.223:https 
2026-01-26 06:23:25,862 | INFO | WIRESHARK | Ether / IP / TCP 167.82.56.223:https > 172.21.174.213:40420 A / Raw
2026-01-26 06:23:25,864 | INFO | WIRESHARK | Ether / IP / TCP 167.82.56.223:https > 172.21.174.213:40420 
2026-01-26 06:23:25,866 | INFO | WIRESHARK | Ether / IP / TCP 172.21.174.213:40420 > 167.82.56.223:https A
2026-01-26 06:23:25,870 | INFO | WIRESHARK | Ether / IP / TCP 172.21.174.213:40420 > 167.82.56.223:https 
2026-01-26 06:23:25,920 | INFO | WIRESHARK | Ether / IP / TCP 167.82.56.223:https > 172.21.174.213:40420 A / Raw
2026-01-26 06:23:25,922 | INFO | WIRESHARK | Ether / IP / TCP 167.82.56.223:https > 172.21.174.213:40420 
2026-01-26 06:23:25,937 | INFO | WIRESHARK | Ether / IP / TCP 167.82.56.223:https > 172.21.174.213:40420 PA / Raw
2026-01-26 06:23:25,938 | INFO | WIRESHARK | Ether / IP / TCP 167.82.56.223:https > 172.21.174.213:40420 
2026-01-26 06:23:25,941 | INFO | WIRESHARK | Ether / IP / TCP 172.21.174.213:40420 > 167.82.56.223:https A
2026-01-26 06:23:25,945 | INFO | WIRESHARK | Ether / IP / TCP 172.21.174.213:40420 > 167.82.56.223:https 
2026-01-26 06:23:25,959 | INFO | WIRESHARK | Ether / IP / TCP 172.21.174.213:41220 > 151.101.0.223:https 
2026-01-26 06:23:25,960 | INFO | WIRESHARK | Ether / IP / TCP 172.21.174.213:41220 > 151.101.0.223:https PA / Raw
2026-01-26 06:23:26,026 | INFO | WIRESHARK | Ether / IP / TCP 151.101.0.223:https > 172.21.174.213:41220 PA / Raw
2026-01-26 06:23:26,027 | INFO | WIRESHARK | Ether / IP / TCP 151.101.0.223:https > 172.21.174.213:41220 
2026-01-26 06:23:26,030 | INFO | WIRESHARK | Ether / IP / TCP 172.21.174.213:41220 > 151.101.0.223:https A
2026-01-26 06:23:26,034 | INFO | WIRESHARK | Ether / IP / TCP 172.21.174.213:41220 > 151.101.0.223:https 
2026-01-26 06:23:26,038 | INFO | WIRESHARK | Ether / IP / TCP 151.101.0.223:https > 172.21.174.213:41220 PA / Raw
2026-01-26 06:23:26,042 | INFO | WIRESHARK | Ether / IP / TCP 151.101.0.223:https > 172.21.174.213:41220 
2026-01-26 06:23:26,045 | INFO | WIRESHARK | Ether / IP / TCP 172.21.174.213:41220 > 151.101.0.223:https A
2026-01-26 06:23:26,049 | INFO | WIRESHARK | Ether / IP / TCP 172.21.174.213:41220 > 151.101.0.223:https 
2026-01-26 06:23:26,055 | INFO | WIRESHARK | Ether / IP / TCP 151.101.0.223:https > 172.21.174.213:41220 A / Raw
2026-01-26 06:23:26,056 | INFO | WIRESHARK | Ether / IP / TCP 151.101.0.223:https > 172.21.174.213:41220 
2026-01-26 06:23:26,059 | INFO | WIRESHARK | Ether / IP / TCP 172.21.174.213:41220 > 151.101.0.223:https A
2026-01-26 06:23:26,063 | INFO | WIRESHARK | Ether / IP / TCP 172.21.174.213:41220 > 151.101.0.223:https 
2026-01-26 06:23:26,090 | INFO | WIRESHARK | Ether / IP / TCP 151.101.0.223:https > 172.21.174.213:41220 
2026-01-26 06:23:26,091 | INFO | WIRESHARK | Ether / IP / TCP 151.101.0.223:https > 172.21.174.213:41220 PA / Raw
2026-01-26 06:23:26,094 | INFO | WIRESHARK | Ether / IP / TCP 172.21.174.213:41220 > 151.101.0.223:https 
2026-01-26 06:23:26,097 | INFO | WIRESHARK | Ether / IP / TCP 172.21.174.213:41220 > 151.101.0.223:https A
2026-01-26 06:23:26,101 | INFO | WIRESHARK | Ether / IP / TCP 151.101.0.223:https > 172.21.174.213:41220 
2026-01-26 06:23:26,103 | INFO | WIRESHARK | Ether / IP / TCP 151.101.0.223:https > 172.21.174.213:41220 PA / Raw
2026-01-26 06:23:26,107 | INFO | WIRESHARK | Ether / IP / TCP 172.21.174.213:41220 > 151.101.0.223:https 
2026-01-26 06:23:26,109 | INFO | WIRESHARK | Ether / IP / TCP 172.21.174.213:41220 > 151.101.0.223:https A
2026-01-26 06:23:26,122 | INFO | WIRESHARK | Ether / IP / TCP 151.101.0.223:https > 172.21.174.213:41220 A / Raw
2026-01-26 06:23:26,123 | INFO | WIRESHARK | Ether / IP / TCP 151.101.0.223:https > 172.21.174.213:41220 
2026-01-26 06:23:26,127 | INFO | WIRESHARK | Ether / IP / TCP 172.21.174.213:41220 > 151.101.0.223:https A
2026-01-26 06:23:26,131 | INFO | WIRESHARK | Ether / IP / TCP 172.21.174.213:41220 > 151.101.0.223:https 
2026-01-26 06:23:26,155 | INFO | WIRESHARK | Ether / IP / TCP 151.101.0.223:https > 172.21.174.213:41220 
2026-01-26 06:23:26,156 | INFO | WIRESHARK | Ether / IP / TCP 151.101.0.223:https > 172.21.174.213:41220 A / Raw
2026-01-26 06:23:26,159 | INFO | WIRESHARK | Ether / IP / TCP 172.21.174.213:41220 > 151.101.0.223:https 
2026-01-26 06:23:26,162 | INFO | WIRESHARK | Ether / IP / TCP 172.21.174.213:41220 > 151.101.0.223:https A
2026-01-26 06:23:26,165 | INFO | WIRESHARK | Ether / IP / TCP 151.101.0.223:https > 172.21.174.213:41220 
2026-01-26 06:23:26,168 | INFO | WIRESHARK | Ether / IP / TCP 151.101.0.223:https > 172.21.174.213:41220 PA / Raw
2026-01-26 06:23:26,172 | INFO | WIRESHARK | Ether / IP / TCP 172.21.174.213:41220 > 151.101.0.223:https 
2026-01-26 06:23:26,175 | INFO | WIRESHARK | Ether / IP / TCP 172.21.174.213:41220 > 151.101.0.223:https A
2026-01-26 06:23:26,178 | INFO | WIRESHARK | Ether / IP / TCP 151.101.0.223:https > 172.21.174.213:41220 
2026-01-26 06:23:26,181 | INFO | WIRESHARK | Ether / IP / TCP 151.101.0.223:https > 172.21.174.213:41220 A / Raw
2026-01-26 06:23:26,183 | INFO | WIRESHARK | Ether / IP / TCP 172.21.174.213:41220 > 151.101.0.223:https 
2026-01-26 06:23:26,187 | INFO | WIRESHARK | Ether / IP / TCP 172.21.174.213:41220 > 151.101.0.223:https A
2026-01-26 06:23:26,189 | INFO | WIRESHARK | Ether / IP / TCP 151.101.0.223:https > 172.21.174.213:41220 
2026-01-26 06:23:26,191 | INFO | WIRESHARK | Ether / IP / TCP 151.101.0.223:https > 172.21.174.213:41220 PA / Raw
2026-01-26 06:23:26,194 | INFO | WIRESHARK | Ether / IP / TCP 172.21.174.213:41220 > 151.101.0.223:https 
2026-01-26 06:23:26,195 | INFO | WIRESHARK | Ether / IP / TCP 172.21.174.213:41220 > 151.101.0.223:https A
2026-01-26 06:23:26,198 | INFO | WIRESHARK | Ether / IP / TCP 151.101.0.223:https > 172.21.174.213:41220 
2026-01-26 06:23:26,200 | INFO | WIRESHARK | Ether / IP / TCP 151.101.0.223:https > 172.21.174.213:41220 A / Raw
2026-01-26 06:23:26,203 | INFO | WIRESHARK | Ether / IP / TCP 172.21.174.213:41220 > 151.101.0.223:https 
2026-01-26 06:23:26,206 | INFO | WIRESHARK | Ether / IP / TCP 172.21.174.213:41220 > 151.101.0.223:https A
2026-01-26 06:23:26,208 | INFO | WIRESHARK | Ether / IP / TCP 151.101.0.223:https > 172.21.174.213:41220 
2026-01-26 06:23:26,211 | INFO | WIRESHARK | Ether / IP / TCP 151.101.0.223:https > 172.21.174.213:41220 PA / Raw
2026-01-26 06:23:26,214 | INFO | WIRESHARK | Ether / IP / TCP 172.21.174.213:41220 > 151.101.0.223:https 
2026-01-26 06:23:26,216 | INFO | WIRESHARK | Ether / IP / TCP 172.21.174.213:41220 > 151.101.0.223:https A
2026-01-26 06:23:26,258 | INFO | WIRESHARK | Ether / IP / TCP 151.101.0.223:https > 172.21.174.213:41220 A / Raw
2026-01-26 06:23:26,259 | INFO | WIRESHARK | Ether / IP / TCP 151.101.0.223:https > 172.21.174.213:41220 
2026-01-26 06:23:26,263 | INFO | WIRESHARK | Ether / IP / TCP 172.21.174.213:41220 > 151.101.0.223:https A
2026-01-26 06:23:26,267 | INFO | WIRESHARK | Ether / IP / TCP 172.21.174.213:41220 > 151.101.0.223:https 
2026-01-26 06:23:26,270 | INFO | WIRESHARK | Ether / IP / TCP 151.101.0.223:https > 172.21.174.213:41220 PA / Raw
2026-01-26 06:23:26,273 | INFO | WIRESHARK | Ether / IP / TCP 151.101.0.223:https > 172.21.174.213:41220 
2026-01-26 06:23:26,276 | INFO | WIRESHARK | Ether / IP / TCP 172.21.174.213:41220 > 151.101.0.223:https A
2026-01-26 06:23:26,279 | INFO | WIRESHARK | Ether / IP / TCP 172.21.174.213:41220 > 151.101.0.223:https 
2026-01-26 06:23:26,283 | INFO | WIRESHARK | Ether / IP / TCP 151.101.0.223:https > 172.21.174.213:41220 PA / Raw
2026-01-26 06:23:26,286 | INFO | WIRESHARK | Ether / IP / TCP 151.101.0.223:https > 172.21.174.213:41220 
2026-01-26 06:23:26,289 | INFO | WIRESHARK | Ether / IP / TCP 172.21.174.213:41220 > 151.101.0.223:https A
2026-01-26 06:23:26,292 | INFO | WIRESHARK | Ether / IP / TCP 172.21.174.213:41220 > 151.101.0.223:https 
2026-01-26 06:23:26,341 | INFO | WIRESHARK | Ether / IP / TCP 151.101.0.223:https > 172.21.174.213:41220 A / Raw
2026-01-26 06:23:26,342 | INFO | WIRESHARK | Ether / IP / TCP 151.101.0.223:https > 172.21.174.213:41220 
2026-01-26 06:23:26,346 | INFO | WIRESHARK | Ether / IP / TCP 172.21.174.213:41220 > 151.101.0.223:https A
2026-01-26 06:23:26,349 | INFO | WIRESHARK | Ether / IP / TCP 172.21.174.213:41220 > 151.101.0.223:https 
2026-01-26 06:23:26,353 | INFO | WIRESHARK | Ether / IP / TCP 151.101.0.223:https > 172.21.174.213:41220 A / Raw
2026-01-26 06:23:26,356 | INFO | WIRESHARK | Ether / IP / TCP 151.101.0.223:https > 172.21.174.213:41220 
2026-01-26 06:23:26,393 | INFO | WIRESHARK | Ether / IP / TCP 172.21.174.213:41220 > 151.101.0.223:https A
2026-01-26 06:23:26,395 | INFO | WIRESHARK | Ether / IP / TCP 172.21.174.213:41220 > 151.101.0.223:https 
2026-01-26 06:23:26,405 | INFO | WIRESHARK | Ether / IP / TCP 151.101.0.223:https > 172.21.174.213:41220 PA / Raw
2026-01-26 06:23:26,407 | INFO | WIRESHARK | Ether / IP / TCP 151.101.0.223:https > 172.21.174.213:41220 
2026-01-26 06:23:26,410 | INFO | WIRESHARK | Ether / IP / TCP 172.21.174.213:41220 > 151.101.0.223:https A
2026-01-26 06:23:26,414 | INFO | WIRESHARK | Ether / IP / TCP 172.21.174.213:41220 > 151.101.0.223:https 
2026-01-26 06:23:26,458 | INFO | WIRESHARK | Ether / IP / TCP 151.101.0.223:https > 172.21.174.213:41220 
2026-01-26 06:23:26,459 | INFO | WIRESHARK | Ether / IP / TCP 151.101.0.223:https > 172.21.174.213:41220 PA / Raw
2026-01-26 06:23:26,462 | INFO | WIRESHARK | Ether / IP / TCP 172.21.174.213:41220 > 151.101.0.223:https 
2026-01-26 06:23:26,466 | INFO | WIRESHARK | Ether / IP / TCP 172.21.174.213:41220 > 151.101.0.223:https A
2026-01-26 06:23:26,473 | INFO | WIRESHARK | Ether / IP / TCP 151.101.0.223:https > 172.21.174.213:41220 PA / Raw
2026-01-26 06:23:26,474 | INFO | WIRESHARK | Ether / IP / TCP 151.101.0.223:https > 172.21.174.213:41220 
2026-01-26 06:23:26,478 | INFO | WIRESHARK | Ether / IP / TCP 172.21.174.213:41220 > 151.101.0.223:https A
2026-01-26 06:23:26,481 | INFO | WIRESHARK | Ether / IP / TCP 172.21.174.213:41220 > 151.101.0.223:https 
2026-01-26 06:23:26,492 | INFO | WIRESHARK | Ether / IP / TCP 151.101.0.223:https > 172.21.174.213:41220 
2026-01-26 06:23:26,494 | INFO | WIRESHARK | Ether / IP / TCP 151.101.0.223:https > 172.21.174.213:41220 A / Raw
2026-01-26 06:23:26,528 | INFO | WIRESHARK | Ether / IP / TCP 151.101.0.223:https > 172.21.174.213:41220 
2026-01-26 06:23:26,529 | INFO | WIRESHARK | Ether / IP / TCP 151.101.0.223:https > 172.21.174.213:41220 PA / Raw
2026-01-26 06:23:26,533 | INFO | WIRESHARK | Ether / IP / TCP 172.21.174.213:41220 > 151.101.0.223:https 
2026-01-26 06:23:26,536 | INFO | WIRESHARK | Ether / IP / TCP 172.21.174.213:41220 > 151.101.0.223:https A
2026-01-26 06:23:26,539 | INFO | WIRESHARK | Ether / IP / TCP 151.101.0.223:https > 172.21.174.213:41220 
2026-01-26 06:23:26,542 | INFO | WIRESHARK | Ether / IP / TCP 151.101.0.223:https > 172.21.174.213:41220 PA / Raw
2026-01-26 06:23:26,545 | INFO | WIRESHARK | Ether / IP / TCP 172.21.174.213:41220 > 151.101.0.223:https 
2026-01-26 06:23:26,549 | INFO | WIRESHARK | Ether / IP / TCP 172.21.174.213:41220 > 151.101.0.223:https A
2026-01-26 06:23:26,593 | INFO | WIRESHARK | Ether / IP / TCP 151.101.0.223:https > 172.21.174.213:41220 PA / Raw
2026-01-26 06:23:26,594 | INFO | WIRESHARK | Ether / IP / TCP 151.101.0.223:https > 172.21.174.213:41220 
2026-01-26 06:23:26,598 | INFO | WIRESHARK | Ether / IP / TCP 172.21.174.213:41220 > 151.101.0.223:https A
2026-01-26 06:23:26,602 | INFO | WIRESHARK | Ether / IP / TCP 172.21.174.213:41220 > 151.101.0.223:https 
2026-01-26 06:23:26,626 | INFO | WIRESHARK | Ether / IP / TCP 151.101.0.223:https > 172.21.174.213:41220 
2026-01-26 06:23:26,627 | INFO | WIRESHARK | Ether / IP / TCP 151.101.0.223:https > 172.21.174.213:41220 A / Raw
2026-01-26 06:23:26,630 | INFO | WIRESHARK | Ether / IP / TCP 172.21.174.213:41220 > 151.101.0.223:https 
2026-01-26 06:23:26,633 | INFO | WIRESHARK | Ether / IP / TCP 172.21.174.213:41220 > 151.101.0.223:https A
2026-01-26 06:23:26,636 | INFO | WIRESHARK | Ether / IP / TCP 151.101.0.223:https > 172.21.174.213:41220 
2026-01-26 06:23:26,639 | INFO | WIRESHARK | Ether / IP / TCP 151.101.0.223:https > 172.21.174.213:41220 PA / Raw
2026-01-26 06:23:26,643 | INFO | WIRESHARK | Ether / IP / TCP 172.21.174.213:41220 > 151.101.0.223:https 
2026-01-26 06:23:26,646 | INFO | WIRESHARK | Ether / IP / TCP 172.21.174.213:41220 > 151.101.0.223:https A
2026-01-26 06:23:26,658 | INFO | WIRESHARK | Ether / IP / TCP 151.101.0.223:https > 172.21.174.213:41220 PA / Raw
2026-01-26 06:23:26,659 | INFO | WIRESHARK | Ether / IP / TCP 151.101.0.223:https > 172.21.174.213:41220 
2026-01-26 06:23:26,663 | INFO | WIRESHARK | Ether / IP / TCP 172.21.174.213:41220 > 151.101.0.223:https A
2026-01-26 06:23:26,666 | INFO | WIRESHARK | Ether / IP / TCP 172.21.174.213:41220 > 151.101.0.223:https 
2026-01-26 06:23:26,691 | INFO | WIRESHARK | Ether / IP / TCP 151.101.0.223:https > 172.21.174.213:41220 A / Raw
2026-01-26 06:23:26,693 | INFO | WIRESHARK | Ether / IP / TCP 151.101.0.223:https > 172.21.174.213:41220 
2026-01-26 06:23:26,696 | INFO | WIRESHARK | Ether / IP / TCP 172.21.174.213:41220 > 151.101.0.223:https A
2026-01-26 06:23:26,699 | INFO | WIRESHARK | Ether / IP / TCP 172.21.174.213:41220 > 151.101.0.223:https 
2026-01-26 06:23:26,702 | INFO | WIRESHARK | Ether / IP / TCP 151.101.0.223:https > 172.21.174.213:41220 A / Raw
2026-01-26 06:23:26,705 | INFO | WIRESHARK | Ether / IP / TCP 151.101.0.223:https > 172.21.174.213:41220 
2026-01-26 06:23:26,708 | INFO | WIRESHARK | Ether / IP / TCP 172.21.174.213:41220 > 151.101.0.223:https A
2026-01-26 06:23:26,711 | INFO | WIRESHARK | Ether / IP / TCP 172.21.174.213:41220 > 151.101.0.223:https 
2026-01-26 06:23:26,724 | INFO | WIRESHARK | Ether / IP / TCP 151.101.0.223:https > 172.21.174.213:41220 PA / Raw
2026-01-26 06:23:26,725 | INFO | WIRESHARK | Ether / IP / TCP 151.101.0.223:https > 172.21.174.213:41220 
2026-01-26 06:23:26,728 | INFO | WIRESHARK | Ether / IP / TCP 172.21.174.213:41220 > 151.101.0.223:https A
2026-01-26 06:23:26,731 | INFO | WIRESHARK | Ether / IP / TCP 172.21.174.213:41220 > 151.101.0.223:https 
2026-01-26 06:23:26,755 | INFO | WIRESHARK | Ether / IP / TCP 151.101.0.223:https > 172.21.174.213:41220 A / Raw
2026-01-26 06:23:26,757 | INFO | WIRESHARK | Ether / IP / TCP 151.101.0.223:https > 172.21.174.213:41220 
2026-01-26 06:23:26,788 | INFO | WIRESHARK | Ether / IP / TCP 151.101.0.223:https > 172.21.174.213:41220 
2026-01-26 06:23:26,789 | INFO | WIRESHARK | Ether / IP / TCP 151.101.0.223:https > 172.21.174.213:41220 A / Raw
2026-01-26 06:23:26,792 | INFO | WIRESHARK | Ether / IP / TCP 172.21.174.213:41220 > 151.101.0.223:https 
2026-01-26 06:23:26,795 | INFO | WIRESHARK | Ether / IP / TCP 172.21.174.213:41220 > 151.101.0.223:https A
2026-01-26 06:23:26,799 | INFO | WIRESHARK | Ether / IP / TCP 151.101.0.223:https > 172.21.174.213:41220 
2026-01-26 06:23:26,802 | INFO | WIRESHARK | Ether / IP / TCP 151.101.0.223:https > 172.21.174.213:41220 PA / Raw
2026-01-26 06:23:26,806 | INFO | WIRESHARK | Ether / IP / TCP 172.21.174.213:41220 > 151.101.0.223:https 
2026-01-26 06:23:26,809 | INFO | WIRESHARK | Ether / IP / TCP 172.21.174.213:41220 > 151.101.0.223:https A
2026-01-26 06:23:26,812 | INFO | WIRESHARK | Ether / IP / TCP 151.101.0.223:https > 172.21.174.213:41220 
2026-01-26 06:23:26,814 | INFO | WIRESHARK | Ether / IP / TCP 151.101.0.223:https > 172.21.174.213:41220 A / Raw
2026-01-26 06:23:26,848 | INFO | WIRESHARK | Ether / IP / TCP 172.21.174.213:41220 > 151.101.0.223:https 
2026-01-26 06:23:26,849 | INFO | WIRESHARK | Ether / IP / TCP 172.21.174.213:41220 > 151.101.0.223:https A
2026-01-26 06:23:26,852 | INFO | WIRESHARK | Ether / IP / TCP 151.101.0.223:https > 172.21.174.213:41220 
2026-01-26 06:23:26,855 | INFO | WIRESHARK | Ether / IP / TCP 151.101.0.223:https > 172.21.174.213:41220 A / Raw
2026-01-26 06:23:26,858 | INFO | WIRESHARK | Ether / IP / TCP 151.101.0.223:https > 172.21.174.213:41220 
2026-01-26 06:23:26,860 | INFO | WIRESHARK | Ether / IP / TCP 151.101.0.223:https > 172.21.174.213:41220 PA / Raw
2026-01-26 06:23:26,863 | INFO | WIRESHARK | Ether / IP / TCP 172.21.174.213:41220 > 151.101.0.223:https 
2026-01-26 06:23:26,866 | INFO | WIRESHARK | Ether / IP / TCP 172.21.174.213:41220 > 151.101.0.223:https A
2026-01-26 06:23:26,871 | INFO | WIRESHARK | Ether / IP / TCP 151.101.0.223:https > 172.21.174.213:41220 
2026-01-26 06:23:26,875 | INFO | WIRESHARK | Ether / IP / TCP 151.101.0.223:https > 172.21.174.213:41220 PA / Raw
2026-01-26 06:23:26,877 | INFO | WIRESHARK | Ether / IP / TCP 172.21.174.213:41220 > 151.101.0.223:https 
2026-01-26 06:23:26,879 | INFO | WIRESHARK | Ether / IP / TCP 172.21.174.213:41220 > 151.101.0.223:https A
2026-01-26 06:23:26,914 | INFO | WIRESHARK | Ether / IP / TCP 151.101.0.223:https > 172.21.174.213:41220 A / Raw
2026-01-26 06:23:26,916 | INFO | WIRESHARK | Ether / IP / TCP 151.101.0.223:https > 172.21.174.213:41220 
2026-01-26 06:23:26,919 | INFO | WIRESHARK | Ether / IP / TCP 151.101.0.223:https > 172.21.174.213:41220 PA / Raw
2026-01-26 06:23:26,923 | INFO | WIRESHARK | Ether / IP / TCP 151.101.0.223:https > 172.21.174.213:41220 
2026-01-26 06:23:26,926 | INFO | WIRESHARK | Ether / IP / TCP 172.21.174.213:41220 > 151.101.0.223:https A
2026-01-26 06:23:26,930 | INFO | WIRESHARK | Ether / IP / TCP 172.21.174.213:41220 > 151.101.0.223:https 
2026-01-26 06:23:26,944 | INFO | WIRESHARK | Ether / IP / TCP 151.101.0.223:https > 172.21.174.213:41220 PA / Raw
2026-01-26 06:23:26,946 | INFO | WIRESHARK | Ether / IP / TCP 151.101.0.223:https > 172.21.174.213:41220 
2026-01-26 06:23:26,949 | INFO | WIRESHARK | Ether / IP / TCP 172.21.174.213:41220 > 151.101.0.223:https A
2026-01-26 06:23:26,953 | INFO | WIRESHARK | Ether / IP / TCP 172.21.174.213:41220 > 151.101.0.223:https 
2026-01-26 06:23:26,983 | INFO | WIRESHARK | Ether / IP / TCP 151.101.0.223:https > 172.21.174.213:41220 PA / Raw
2026-01-26 06:23:26,984 | INFO | WIRESHARK | Ether / IP / TCP 151.101.0.223:https > 172.21.174.213:41220 
2026-01-26 06:23:26,987 | INFO | WIRESHARK | Ether / IP / TCP 172.21.174.213:41220 > 151.101.0.223:https A
2026-01-26 06:23:26,990 | INFO | WIRESHARK | Ether / IP / TCP 172.21.174.213:41220 > 151.101.0.223:https 
2026-01-26 06:23:27,008 | INFO | WIRESHARK | Ether / IP / TCP 151.101.0.223:https > 172.21.174.213:41220 PA / Raw
2026-01-26 06:23:27,009 | INFO | WIRESHARK | Ether / IP / TCP 151.101.0.223:https > 172.21.174.213:41220 
2026-01-26 06:23:27,012 | INFO | WIRESHARK | Ether / IP / TCP 172.21.174.213:41220 > 151.101.0.223:https A
2026-01-26 06:23:27,015 | INFO | WIRESHARK | Ether / IP / TCP 172.21.174.213:41220 > 151.101.0.223:https 
2026-01-26 06:23:27,020 | INFO | WIRESHARK | Ether / IP / TCP 151.101.0.223:https > 172.21.174.213:41220 A / Raw
2026-01-26 06:23:27,021 | INFO | WIRESHARK | Ether / IP / TCP 151.101.0.223:https > 172.21.174.213:41220 
2026-01-26 06:23:27,049 | INFO | WIRESHARK | Ether / IP / TCP 151.101.0.223:https > 172.21.174.213:41220 
2026-01-26 06:23:27,050 | INFO | WIRESHARK | Ether / IP / TCP 151.101.0.223:https > 172.21.174.213:41220 PA / Raw
2026-01-26 06:23:27,053 | INFO | WIRESHARK | Ether / IP / TCP 172.21.174.213:41220 > 151.101.0.223:https 
2026-01-26 06:23:27,055 | INFO | WIRESHARK | Ether / IP / TCP 172.21.174.213:41220 > 151.101.0.223:https A
2026-01-26 06:23:27,074 | INFO | WIRESHARK | Ether / IP / TCP 151.101.0.223:https > 172.21.174.213:41220 A / Raw
2026-01-26 06:23:27,075 | INFO | WIRESHARK | Ether / IP / TCP 151.101.0.223:https > 172.21.174.213:41220 
2026-01-26 06:23:27,078 | INFO | WIRESHARK | Ether / IP / TCP 151.101.0.223:https > 172.21.174.213:41220 PA / Raw
2026-01-26 06:23:27,081 | INFO | WIRESHARK | Ether / IP / TCP 151.101.0.223:https > 172.21.174.213:41220 
2026-01-26 06:23:27,085 | INFO | WIRESHARK | Ether / IP / TCP 172.21.174.213:41220 > 151.101.0.223:https A
2026-01-26 06:23:27,088 | INFO | WIRESHARK | Ether / IP / TCP 172.21.174.213:41220 > 151.101.0.223:https 
2026-01-26 06:23:27,114 | INFO | WIRESHARK | Ether / IP / TCP 151.101.0.223:https > 172.21.174.213:41220 PA / Raw
2026-01-26 06:23:27,115 | INFO | WIRESHARK | Ether / IP / TCP 151.101.0.223:https > 172.21.174.213:41220 
2026-01-26 06:23:27,118 | INFO | WIRESHARK | Ether / IP / TCP 172.21.174.213:41220 > 151.101.0.223:https A
2026-01-26 06:23:27,121 | INFO | WIRESHARK | Ether / IP / TCP 172.21.174.213:41220 > 151.101.0.223:https 
2026-01-26 06:23:27,124 | INFO | WIRESHARK | Ether / IP / TCP 151.101.0.223:https > 172.21.174.213:41220 A / Raw
2026-01-26 06:23:27,127 | INFO | WIRESHARK | Ether / IP / TCP 151.101.0.223:https > 172.21.174.213:41220 
2026-01-26 06:23:27,135 | INFO | WIRESHARK | Ether / IP / TCP 151.101.0.223:https > 172.21.174.213:41220 
2026-01-26 06:23:27,137 | INFO | WIRESHARK | Ether / IP / TCP 151.101.0.223:https > 172.21.174.213:41220 PA / Raw
2026-01-26 06:23:27,139 | INFO | WIRESHARK | Ether / IP / TCP 172.21.174.213:41220 > 151.101.0.223:https 
2026-01-26 06:23:27,142 | INFO | WIRESHARK | Ether / IP / TCP 172.21.174.213:41220 > 151.101.0.223:https A
2026-01-26 06:23:27,146 | INFO | WIRESHARK | Ether / IP / TCP 151.101.0.223:https > 172.21.174.213:41220 
2026-01-26 06:23:27,148 | INFO | WIRESHARK | Ether / IP / TCP 151.101.0.223:https > 172.21.174.213:41220 A / Raw
2026-01-26 06:23:27,184 | INFO | WIRESHARK | Ether / IP / TCP 172.21.174.213:41220 > 151.101.0.223:https 
2026-01-26 06:23:27,185 | INFO | WIRESHARK | Ether / IP / TCP 172.21.174.213:41220 > 151.101.0.223:https A
2026-01-26 06:23:27,200 | INFO | WIRESHARK | Ether / IP / TCP 151.101.0.223:https > 172.21.174.213:41220 PA / Raw
2026-01-26 06:23:27,202 | INFO | WIRESHARK | Ether / IP / TCP 151.101.0.223:https > 172.21.174.213:41220 
2026-01-26 06:23:27,205 | INFO | WIRESHARK | Ether / IP / TCP 172.21.174.213:41220 > 151.101.0.223:https A
2026-01-26 06:23:27,209 | INFO | WIRESHARK | Ether / IP / TCP 172.21.174.213:41220 > 151.101.0.223:https 
2026-01-26 06:23:27,253 | INFO | WIRESHARK | Ether / IP / TCP 151.101.0.223:https > 172.21.174.213:41220 PA / Raw
2026-01-26 06:23:27,257 | INFO | WIRESHARK | Ether / IP / TCP 172.21.174.213:41220 > 151.101.0.223:https A
2026-01-26 06:23:27,254 | INFO | WIRESHARK | Ether / IP / TCP 151.101.0.223:https > 172.21.174.213:41220 
2026-01-26 06:23:27,262 | INFO | WIRESHARK | Ether / IP / TCP 172.21.174.213:41220 > 151.101.0.223:https 
2026-01-26 06:23:27,264 | INFO | WIRESHARK | Ether / IP / TCP 151.101.0.223:https > 172.21.174.213:41220 A / Raw
2026-01-26 06:23:27,269 | INFO | WIRESHARK | Ether / IP / TCP 172.21.174.213:41220 > 151.101.0.223:https A
2026-01-26 06:23:27,266 | INFO | WIRESHARK | Ether / IP / TCP 151.101.0.223:https > 172.21.174.213:41220 
2026-01-26 06:23:27,275 | INFO | WIRESHARK | Ether / IP / TCP 172.21.174.213:41220 > 151.101.0.223:https 
2026-01-26 06:23:27,278 | INFO | WIRESHARK | Ether / IP / TCP 151.101.0.223:https > 172.21.174.213:41220 
2026-01-26 06:23:27,272 | INFO | WIRESHARK | Ether / IP / TCP 151.101.0.223:https > 172.21.174.213:41220 A / Raw
2026-01-26 06:23:27,280 | INFO | WIRESHARK | Ether / IP / TCP 172.21.174.213:41220 > 151.101.0.223:https 
2026-01-26 06:23:27,283 | INFO | WIRESHARK | Ether / IP / TCP 172.21.174.213:41220 > 151.101.0.223:https A
2026-01-26 06:23:27,322 | INFO | WIRESHARK | Ether / IP / TCP 151.101.0.223:https > 172.21.174.213:41220 A / Raw
2026-01-26 06:23:27,323 | INFO | WIRESHARK | Ether / IP / TCP 151.101.0.223:https > 172.21.174.213:41220 
2026-01-26 06:23:27,326 | INFO | WIRESHARK | Ether / IP / TCP 151.101.0.223:https > 172.21.174.213:41220 A / Raw
2026-01-26 06:23:27,329 | INFO | WIRESHARK | Ether / IP / TCP 151.101.0.223:https > 172.21.174.213:41220 
2026-01-26 06:23:27,333 | INFO | WIRESHARK | Ether / IP / TCP 172.21.174.213:41220 > 151.101.0.223:https A
2026-01-26 06:23:27,337 | INFO | WIRESHARK | Ether / IP / TCP 172.21.174.213:41220 > 151.101.0.223:https 
2026-01-26 06:23:27,340 | INFO | WIRESHARK | Ether / IP / TCP 151.101.0.223:https > 172.21.174.213:41220 A / Raw
2026-01-26 06:23:27,343 | INFO | WIRESHARK | Ether / IP / TCP 151.101.0.223:https > 172.21.174.213:41220 
2026-01-26 06:23:27,347 | INFO | WIRESHARK | Ether / IP / TCP 172.21.174.213:41220 > 151.101.0.223:https A
2026-01-26 06:23:27,349 | INFO | METRIC | CPU: 2.5% | PKTS: 4041
2026-01-26 06:23:27,350 | INFO | WIRESHARK | Ether / IP / TCP 172.21.174.213:41220 > 151.101.0.223:https 
2026-01-26 06:23:27,354 | INFO | WIRESHARK | Ether / IP / TCP 151.101.0.223:https > 172.21.174.213:41220 A / Raw
2026-01-26 06:23:27,358 | INFO | WIRESHARK | Ether / IP / TCP 151.101.0.223:https > 172.21.174.213:41220 
2026-01-26 06:23:27,384 | INFO | WIRESHARK | Ether / IP / TCP 172.21.174.213:41220 > 151.101.0.223:https 
2026-01-26 06:23:27,385 | INFO | WIRESHARK | Ether / IP / TCP 172.21.174.213:41220 > 151.101.0.223:https A
2026-01-26 06:23:27,388 | INFO | WIRESHARK | Ether / IP / TCP 151.101.0.223:https > 172.21.174.213:41220 
2026-01-26 06:23:27,391 | INFO | WIRESHARK | Ether / IP / TCP 151.101.0.223:https > 172.21.174.213:41220 A / Raw
2026-01-26 06:23:27,403 | INFO | WIRESHARK | Ether / IP / TCP 151.101.0.223:https > 172.21.174.213:41220 PA / Raw
2026-01-26 06:23:27,404 | INFO | WIRESHARK | Ether / IP / TCP 151.101.0.223:https > 172.21.174.213:41220 
2026-01-26 06:23:27,406 | INFO | WIRESHARK | Ether / IP / TCP 172.21.174.213:41220 > 151.101.0.223:https A
2026-01-26 06:23:27,409 | INFO | WIRESHARK | Ether / IP / TCP 172.21.174.213:41220 > 151.101.0.223:https 
2026-01-26 06:23:27,450 | INFO | WIRESHARK | Ether / IP / TCP 151.101.0.223:https > 172.21.174.213:41220 PA / Raw
2026-01-26 06:23:27,452 | INFO | WIRESHARK | Ether / IP / TCP 151.101.0.223:https > 172.21.174.213:41220 
2026-01-26 06:23:27,455 | INFO | WIRESHARK | Ether / IP / TCP 172.21.174.213:41220 > 151.101.0.223:https A
2026-01-26 06:23:27,458 | INFO | WIRESHARK | Ether / IP / TCP 172.21.174.213:41220 > 151.101.0.223:https 
2026-01-26 06:23:27,469 | INFO | WIRESHARK | Ether / IP / TCP 151.101.0.223:https > 172.21.174.213:41220 PA / Raw
2026-01-26 06:23:27,470 | INFO | WIRESHARK | Ether / IP / TCP 151.101.0.223:https > 172.21.174.213:41220 
2026-01-26 06:23:27,472 | INFO | WIRESHARK | Ether / IP / TCP 172.21.174.213:41220 > 151.101.0.223:https A
2026-01-26 06:23:27,476 | INFO | WIRESHARK | Ether / IP / TCP 172.21.174.213:41220 > 151.101.0.223:https 
2026-01-26 06:23:27,488 | INFO | WIRESHARK | Ether / IP / TCP 151.101.0.223:https > 172.21.174.213:41220 
2026-01-26 06:23:27,490 | INFO | WIRESHARK | Ether / IP / TCP 151.101.0.223:https > 172.21.174.213:41220 A / Raw
2026-01-26 06:23:27,515 | INFO | WIRESHARK | Ether / IP / TCP 151.101.0.223:https > 172.21.174.213:41220 PA / Raw
2026-01-26 06:23:27,516 | INFO | WIRESHARK | Ether / IP / TCP 151.101.0.223:https > 172.21.174.213:41220 
2026-01-26 06:23:27,519 | INFO | WIRESHARK | Ether / IP / TCP 172.21.174.213:41220 > 151.101.0.223:https A
2026-01-26 06:23:27,523 | INFO | WIRESHARK | Ether / IP / TCP 172.21.174.213:41220 > 151.101.0.223:https 
2026-01-26 06:23:27,533 | INFO | WIRESHARK | Ether / IP / TCP 151.101.0.223:https > 172.21.174.213:41220 PA / Raw
2026-01-26 06:23:27,534 | INFO | WIRESHARK | Ether / IP / TCP 151.101.0.223:https > 172.21.174.213:41220 
2026-01-26 06:23:27,537 | INFO | WIRESHARK | Ether / IP / TCP 172.21.174.213:41220 > 151.101.0.223:https A
2026-01-26 06:23:27,540 | INFO | WIRESHARK | Ether / IP / TCP 172.21.174.213:41220 > 151.101.0.223:https 
2026-01-26 06:23:27,591 | INFO | WIRESHARK | Ether / IP / TCP 151.101.0.223:https > 172.21.174.213:41220 A / Raw
2026-01-26 06:23:27,596 | INFO | WIRESHARK | Ether / IP / TCP 172.21.174.213:41220 > 151.101.0.223:https A
2026-01-26 06:23:27,592 | INFO | WIRESHARK | Ether / IP / TCP 151.101.0.223:https > 172.21.174.213:41220 
2026-01-26 06:23:27,601 | INFO | WIRESHARK | Ether / IP / TCP 151.101.0.223:https > 172.21.174.213:41220 PA / Raw
2026-01-26 06:23:27,606 | INFO | WIRESHARK | Ether / IP / TCP 172.21.174.213:41220 > 151.101.0.223:https A
2026-01-26 06:23:27,603 | INFO | WIRESHARK | Ether / IP / TCP 172.21.174.213:41220 > 151.101.0.223:https 
2026-01-26 06:23:27,612 | INFO | WIRESHARK | Ether / IP / TCP 151.101.0.223:https > 172.21.174.213:41220 
2026-01-26 06:23:27,614 | INFO | WIRESHARK | Ether / IP / TCP 172.21.174.213:41220 > 151.101.0.223:https 
2026-01-26 06:23:27,621 | INFO | WIRESHARK | Ether / IP / TCP 151.101.0.223:https > 172.21.174.213:41220 A / Raw
2026-01-26 06:23:27,622 | INFO | WIRESHARK | Ether / IP / TCP 151.101.0.223:https > 172.21.174.213:41220 
2026-01-26 06:23:27,625 | INFO | WIRESHARK | Ether / IP / TCP 172.21.174.213:41220 > 151.101.0.223:https A
2026-01-26 06:23:27,630 | INFO | WIRESHARK | Ether / IP / TCP 172.21.174.213:41220 > 151.101.0.223:https 
2026-01-26 06:23:27,655 | INFO | WIRESHARK | Ether / IP / TCP 151.101.0.223:https > 172.21.174.213:41220 
2026-01-26 06:23:27,657 | INFO | WIRESHARK | Ether / IP / TCP 151.101.0.223:https > 172.21.174.213:41220 A / Raw
2026-01-26 06:23:27,659 | INFO | WIRESHARK | Ether / IP / TCP 172.21.174.213:41220 > 151.101.0.223:https 
2026-01-26 06:23:27,662 | INFO | WIRESHARK | Ether / IP / TCP 172.21.174.213:41220 > 151.101.0.223:https A
2026-01-26 06:23:27,665 | INFO | WIRESHARK | Ether / IP / TCP 151.101.0.223:https > 172.21.174.213:41220 
2026-01-26 06:23:27,669 | INFO | WIRESHARK | Ether / IP / TCP 151.101.0.223:https > 172.21.174.213:41220 A / Raw
2026-01-26 06:23:27,670 | INFO | WIRESHARK | Ether / IP / TCP 172.21.174.213:41220 > 151.101.0.223:https 
2026-01-26 06:23:27,673 | INFO | WIRESHARK | Ether / IP / TCP 172.21.174.213:41220 > 151.101.0.223:https A
2026-01-26 06:23:27,676 | INFO | WIRESHARK | Ether / IP / TCP 151.101.0.223:https > 172.21.174.213:41220 
2026-01-26 06:23:27,679 | INFO | WIRESHARK | Ether / IP / TCP 151.101.0.223:https > 172.21.174.213:41220 A / Raw
2026-01-26 06:23:27,681 | INFO | WIRESHARK | Ether / IP / TCP 172.21.174.213:41220 > 151.101.0.223:https 
2026-01-26 06:23:27,684 | INFO | WIRESHARK | Ether / IP / TCP 172.21.174.213:41220 > 151.101.0.223:https A
2026-01-26 06:23:27,687 | INFO | WIRESHARK | Ether / IP / TCP 151.101.0.223:https > 172.21.174.213:41220 
2026-01-26 06:23:27,689 | INFO | WIRESHARK | Ether / IP / TCP 151.101.0.223:https > 172.21.174.213:41220 A / Raw
2026-01-26 06:23:27,722 | INFO | WIRESHARK | Ether / IP / TCP 151.101.0.223:https > 172.21.174.213:41220 A / Raw
2026-01-26 06:23:27,723 | INFO | WIRESHARK | Ether / IP / TCP 151.101.0.223:https > 172.21.174.213:41220 
2026-01-26 06:23:27,726 | INFO | WIRESHARK | Ether / IP / TCP 172.21.174.213:41220 > 151.101.0.223:https A
2026-01-26 06:23:27,730 | INFO | WIRESHARK | Ether / IP / TCP 172.21.174.213:41220 > 151.101.0.223:https 
2026-01-26 06:23:27,732 | INFO | WIRESHARK | Ether / IP / TCP 151.101.0.223:https > 172.21.174.213:41220 A / Raw
2026-01-26 06:23:27,735 | INFO | WIRESHARK | Ether / IP / TCP 151.101.0.223:https > 172.21.174.213:41220 
2026-01-26 06:23:27,738 | INFO | WIRESHARK | Ether / IP / TCP 151.101.0.223:https > 172.21.174.213:41220 A / Raw
2026-01-26 06:23:27,741 | INFO | WIRESHARK | Ether / IP / TCP 151.101.0.223:https > 172.21.174.213:41220 
2026-01-26 06:23:27,744 | INFO | WIRESHARK | Ether / IP / TCP 172.21.174.213:41220 > 151.101.0.223:https A
2026-01-26 06:23:27,747 | INFO | WIRESHARK | Ether / IP / TCP 172.21.174.213:41220 > 151.101.0.223:https 
2026-01-26 06:23:27,788 | INFO | WIRESHARK | Ether / IP / TCP 151.101.0.223:https > 172.21.174.213:41220 PA / Raw
2026-01-26 06:23:27,789 | INFO | WIRESHARK | Ether / IP / TCP 151.101.0.223:https > 172.21.174.213:41220 
2026-01-26 06:23:27,792 | INFO | WIRESHARK | Ether / IP / TCP 172.21.174.213:41220 > 151.101.0.223:https A
2026-01-26 06:23:27,795 | INFO | WIRESHARK | Ether / IP / TCP 172.21.174.213:41220 > 151.101.0.223:https 
2026-01-26 06:23:27,803 | INFO | WIRESHARK | Ether / IP / TCP 151.101.0.223:https > 172.21.174.213:41220 PA / Raw
2026-01-26 06:23:27,804 | INFO | WIRESHARK | Ether / IP / TCP 151.101.0.223:https > 172.21.174.213:41220 
2026-01-26 06:23:27,808 | INFO | WIRESHARK | Ether / IP / TCP 172.21.174.213:41220 > 151.101.0.223:https A
2026-01-26 06:23:27,811 | INFO | WIRESHARK | Ether / IP / TCP 172.21.174.213:41220 > 151.101.0.223:https 
2026-01-26 06:23:27,827 | INFO | WIRESHARK | Ether / IP / TCP 151.101.0.223:https > 172.21.174.213:41220 A / Raw
2026-01-26 06:23:27,829 | INFO | WIRESHARK | Ether / IP / TCP 151.101.0.223:https > 172.21.174.213:41220 
2026-01-26 06:23:27,851 | INFO | WIRESHARK | Ether / IP / TCP 151.101.0.223:https > 172.21.174.213:41220 
2026-01-26 06:23:27,853 | INFO | WIRESHARK | Ether / IP / TCP 151.101.0.223:https > 172.21.174.213:41220 PA / Raw
2026-01-26 06:23:27,855 | INFO | WIRESHARK | Ether / IP / TCP 172.21.174.213:41220 > 151.101.0.223:https 
2026-01-26 06:23:27,857 | INFO | WIRESHARK | Ether / IP / TCP 172.21.174.213:41220 > 151.101.0.223:https A
2026-01-26 06:23:28,101 | INFO | WIRESHARK | Ether / IP / TCP 172.21.174.213:40420 > 167.82.56.223:https PA / Raw
2026-01-26 06:23:28,102 | INFO | WIRESHARK | Ether / IP / TCP 172.21.174.213:40420 > 167.82.56.223:https 
2026-01-26 06:23:28,178 | INFO | WIRESHARK | Ether / IP / TCP 167.82.56.223:https > 172.21.174.213:40420 A
2026-01-26 06:23:28,180 | INFO | WIRESHARK | Ether / IP / TCP 167.82.56.223:https > 172.21.174.213:40420 
2026-01-26 06:23:28,185 | INFO | WIRESHARK | Ether / IP / TCP 167.82.56.223:https > 172.21.174.213:40420 PA / Raw
2026-01-26 06:23:28,188 | INFO | WIRESHARK | Ether / IP / TCP 167.82.56.223:https > 172.21.174.213:40420 
2026-01-26 06:23:28,191 | INFO | WIRESHARK | Ether / IP / TCP 172.21.174.213:40420 > 167.82.56.223:https A
2026-01-26 06:23:28,194 | INFO | WIRESHARK | Ether / IP / TCP 172.21.174.213:40420 > 167.82.56.223:https 
2026-01-26 06:23:28,202 | INFO | WIRESHARK | Ether / IP / TCP 167.82.56.223:https > 172.21.174.213:40420 A / Raw
2026-01-26 06:23:28,203 | INFO | WIRESHARK | Ether / IP / TCP 167.82.56.223:https > 172.21.174.213:40420 
2026-01-26 06:23:28,206 | INFO | WIRESHARK | Ether / IP / TCP 172.21.174.213:40420 > 167.82.56.223:https A
2026-01-26 06:23:28,209 | INFO | WIRESHARK | Ether / IP / TCP 172.21.174.213:40420 > 167.82.56.223:https 
2026-01-26 06:23:28,232 | INFO | WIRESHARK | Ether / IP / TCP 167.82.56.223:https > 172.21.174.213:40420 A / Raw
2026-01-26 06:23:28,233 | INFO | WIRESHARK | Ether / IP / TCP 167.82.56.223:https > 172.21.174.213:40420 
2026-01-26 06:23:28,236 | INFO | WIRESHARK | Ether / IP / TCP 172.21.174.213:40420 > 167.82.56.223:https A
2026-01-26 06:23:28,239 | INFO | WIRESHARK | Ether / IP / TCP 172.21.174.213:40420 > 167.82.56.223:https 
2026-01-26 06:23:28,258 | INFO | WIRESHARK | Ether / IP / TCP 167.82.56.223:https > 172.21.174.213:40420 
2026-01-26 06:23:28,259 | INFO | WIRESHARK | Ether / IP / TCP 167.82.56.223:https > 172.21.174.213:40420 A / Raw
2026-01-26 06:23:28,268 | INFO | WIRESHARK | Ether / IP / TCP 172.21.174.213:40420 > 167.82.56.223:https 
2026-01-26 06:23:28,272 | INFO | WIRESHARK | Ether / IP / TCP 172.21.174.213:40420 > 167.82.56.223:https A
2026-01-26 06:23:28,276 | INFO | WIRESHARK | Ether / IP / TCP 167.82.56.223:https > 172.21.174.213:40420 A / Raw
2026-01-26 06:23:28,277 | INFO | WIRESHARK | Ether / IP / TCP 167.82.56.223:https > 172.21.174.213:40420 
2026-01-26 06:23:28,279 | INFO | WIRESHARK | Ether / IP / TCP 172.21.174.213:40420 > 167.82.56.223:https A
2026-01-26 06:23:28,281 | INFO | WIRESHARK | Ether / IP / TCP 172.21.174.213:40420 > 167.82.56.223:https 
2026-01-26 06:23:28,308 | INFO | WIRESHARK | Ether / IP / TCP 167.82.56.223:https > 172.21.174.213:40420 A / Raw
2026-01-26 06:23:28,309 | INFO | WIRESHARK | Ether / IP / TCP 167.82.56.223:https > 172.21.174.213:40420 
2026-01-26 06:23:28,313 | INFO | WIRESHARK | Ether / IP / TCP 172.21.174.213:40420 > 167.82.56.223:https A
2026-01-26 06:23:28,316 | INFO | WIRESHARK | Ether / IP / TCP 172.21.174.213:40420 > 167.82.56.223:https 
2026-01-26 06:23:28,333 | INFO | WIRESHARK | Ether / IP / TCP 167.82.56.223:https > 172.21.174.213:40420 A / Raw
